Book	Chapter	Verse	TextRomans	1	22	Sa ila pagpadayag nga mga maalam, nanginbuangbuang sila,
Romans	1	23	kag nagbaylo sang himaya sang Dios nga dimadinulunton sa kaanggid sang mga larawan sang tawo nga madinulunton ukon mga pispis ukon mga sapat nga apat sing tiil ukon mga sapat nga nagasaug.
Romans	1	24	Busa ginpatumbayaan sila sang Dios sa mga kailigbon sang ila mga tagiposoon sa kahigkoan, sa pagpakahuya sang ila mga lawas sa tunga nila,
Romans	1	25	kay ginbaylo nila sa butig ang kamatooran sang Dios kag nagsimba kag nag-alagad sang tinuga sa baylo sang Manunuga, nga dalayawon sa gihapon! Kabay pa.
Romans	1	26	Sa sining kabangdanan ginpatumbayaan sila sang Dios sa mga balatyagon nga makahuluya. Ang ila kababayin-an nagbaylo sang mga paggamit nga kinaugali sa mga batok sa kinaugali,
Romans	1	27	kag sa amo man nga bagay ang kalalakin-an nagabiya sang kinaugali nga mga paggamit sang mga babayi kag nasonog sa ila kailigbon sa isa kag isa, ang mga lalaki sa mga lalaki nagabuhat sang makahuluya kag nagabaton sa ila mga kaugalingon sang silot nga nagakaigo sa ila sayup.
Romans	1	28	Kag sanglit nagdumili sila sa pagkilala sa Dios, ginpatumbayaan sila sang Dios sa panghunahuna nga dunut kag sa paggawi nga dinagakaigo.
Romans	1	29	Napun-an sila sang tanan nga pagkadimatarung, pagkamalaut, pagkamahamkonon, pagkamalain. Puno sang kahisa, pagpatay, pinuyas, limbong, kadaut, mga palakutsokutso sila,
Romans	1	30	mga malibakon, madinumuton sa Dios, matampalason, palabilabihon, hagakan, mga manugpatok sang malaut nga mga butang, dimatinumanon sa mga ginikanan,
Romans	1	31	mga walay paghangup, dimasaligan, walay gugma, dimaloloy-on.
Romans	1	32	Bisan sila nakahibalo sang pagsolondan sang Dios nga ang mga nagahimo sang amo nga mga butang takus sa kamatayon, indi lamang nagahimo sila sang amo kondi man nagapahanugut sa nagahimo sini.
Romans	10	1	Mga kauturan, ang handum sang akon tagiposoon kag ang akon pangamuyo sa Dios tungud sa ila amo nga maluwas sila.
Romans	10	2	Nagasaksi ako sa ila nga may pagkakugi sila tungud sa Dios, apang indi sono sa ihibalo.
Romans	10	3	Kay, sa wala nila mahibaloi ang pagkamatarung gikan sa Dios, kag sa nagatinguha sa pagtukud sang ila kaugalingon, wala sila magpasakup sa pagkamatarung sang Dios.
Romans	10	4	Kay si Cristo amo ang katapusan sang kasogoan, agud nga mapakamatarung ang tagsatagsa nga may pagtoo.
Romans	10	5	Si Moises nagasulat nga ang tawo nga nagahimo sang pagkamatarung nga sono sa kasogoan magakabuhi paagi sini.
Romans	10	6	Apang ang pagkamatarung nga sono sa pagtoo nagasiling, Dili ka magsiling sa imo tagiposoon, “Sin-o bala ang magasaka sa langit?” (kon sayoron, sa pagpapanaug kay Cristo)
Romans	10	7	ukon “Sin-o bala ang magapanaug sa kadadalman?” (kon sayoron, sa pagpasaka kay Cristo gikan sa mga patay).
Romans	10	8	Apang ano bala ang ginasiling sini? Malapit sa imo ang polong, sa imo baba kag sa imo tagiposoon (kon sayoron, ang polong sang pagtoo nga aton ginawali);
Romans	10	9	bangud nga, kon itu-ad mo sang imo baba nga si Jesus Ginoo kag magtoo sa imo tagiposoon nga ang Dios nagbanhaw sa iya, maluwas ka.
Romans	10	10	Kay sa tagiposoon ang tawo nagatoo nga sa pagkamatarung, kag sa baba ang pagtu-ad ginahimo nga sa kaluwasan.
Romans	10	11	Ang kasulatan nagasiling, “Ang bisan sin-o nga nagatoo sa iya indi pagpakahuy-an.”
Romans	10	12	Kay walay ginkalainan sa Judio kag Griego; kay ang amo nga Ginoo man Ginoo sang tanan kag nagahatag sang iya mga manggad sa tanan nga nagapanawag sa iya.
Romans	10	13	Kay, “ang bisan sin-o nga magtawag sa ngalan sang Ginoo maluwas.”
Romans	10	14	Apang paano bala ang pagpanawag nila sa iya nga wala nila matoohi? Kag paano bala ang pagtoo nila sa iya nga wala nila mabatii? Kag paano bala ang pagkabati nila kon walay manugwali?
Romans	10	15	Kag paano bala ang pagwali nila kon indi sila pag-ipadala? Subong sang nasulat na, “Daw ano katahum sang mga tiil sang mga nagabantala sang maayong balita!”
Romans	10	16	Apang indi ang tanan sa ila nagtuman sang maayong balita; kay si Isaias nagasiling, “Ginoo, sin-o bala ang nagtoo sang amon ginbalita?”
Romans	10	17	Gani ang pagtoo nagaabut gikan sa ginapamatian, kag ang ginapamatian paagi sa polong ni Cristo.
Romans	10	18	Apang nagapamangkot ako, wala bala sila makabati? Hoo sa pagkamatuud; kay “Ang ila tingug naglapnag sa bug-os nga duta, kag ang ila mga polong tubtub sa mga ukbong sang kalibutan.”
Romans	10	19	Sa liwat nagapamangkot ako, wala bala makahangup ang Israel? Sa nahauna si Moises nagasiling, “Papaimonon ko kamo sa sinang indi pungsud; sa pungsud nga nawad-an sing paino-ino paakigon ko kamo.”
Romans	10	20	Niyan si Isaias masidla gid sa pagsiling, “Nakita ako sang mga wala magpangita sa akon; nangindayag ako sa mga wala magpamangkot nahanungud sa akon.”
Romans	10	21	Apang nahanungud sa Israel nagasiling sia, “Sa bug-os nga adlaw gin-untay ko ang akon mga kamut sa katawohan nga dimatinumanon kag malalison.”
Romans	11	1	Niyan nagapamangkot ako, ginsikway bala sang Dios ang iya katawohan? Malayo ina! Ako akon Israelnon, kaliwat ni Abraham, sa kabikahan ni Benjamin.
Romans	11	2	Ang Dios wala magsikway sang iya katawohan nga iya nakilala nga daan. Wala bala ninyo mahibal-i ang ginasiling sang kasulatan nahanungud kay Elias, kon paano nga nagapanumbung sia sa Dios batok sa Israel?
Romans	11	3	“Ginoo, ginpatay nila ang imo mga manalagna, ginwagwag nila ang imo mga halaran, kag nabilin ako nga isa lamang, kag ginatinguha nila ang akon kabuhi.”
Romans	11	4	Apang ano bala ang sabat sang Dios sa iya? “May ginbilin ako nga sa akon nga pito ka libo ka tawo nga wala magpilo sang tuhud kay Baal.”
Romans	11	5	Gani man sa karon nga tion may nabilin sono sa pagpili sang bugay.
Romans	11	6	Apang kon paagi sa bugay, indi na sa mga buhat; sa iban nga bagay ini indi na bugay.
Romans	11	7	Niyan ano bala? Ang ginapangita sang Israel wala niya maagum. Ang pinili nakaagum sini, apang ang nabilin ginpatig-a,
Romans	11	8	sono sa nasulat na, “Ang Dios naghatag sa ila sing espiritu sang pagkadimabinatyagon, mga mata nga indi makakita kag mga dulunggan nga indi makabati, tubtub sini gid nga adlaw.”
Romans	11	9	Kag si David nagasiling, “Pabaya-i ang ila piesta nga manginsiod kag tiglapak, kasandaran kag tumbas sa ila;
Romans	11	10	pabaya-i nga magdulum ang ila mga mata agud nga indi sila makakita, kag magsioktot sa gihapon ang ila mga likod.”
Romans	11	11	Gani nagapamangkot ako, nasandad bala sila agud nga mapukan? Malayo ina! Apang paagi sa ila pagkapukan nag-abut ang kaluwasan sa mga Gentil, sa pagpaimon sang Israel.
Romans	11	12	Karon kon ang ila pagkapukan amo ang kamanggaran sang kalibutan, kag kon ang kadulaan nila kamanggaran sang mga Gentil, daw ano pa gid ang bug-os nila nga pagpasakup!
Romans	11	13	Karon nagahambal ako sa inyo nga mga Gentil. Niyan sanglit ako pinadala sa mga Gentil, ginapakadaku ko ang akon pagpangabudlay
Romans	11	14	agud nga mapaimon ko ang mga masigka-Judio ko, kag sa amo maluwas ang iban sa ila.
Romans	11	15	Kay kon ang pagsikway sa ila amo ang pagpasag-uli sang kalibutan, mangin-ano bala ang pagbaton sa ila kondi kabuhi gikan sa mga patay?
Romans	11	16	Kon ang nahaunang bahin sang linamas balaan, amo man ang kabilogan; kag kon ang gamut balaan, amo man ang mga sanga.
Romans	11	17	Apang kon ang iban sang mga sanga ginbanggi, kag ikaw, talonon nga olivo, ginsumpay sa tal-us nila sa pag-ambit sang kabuganaan sang olivo,
Romans	11	18	dili ka magpabugal sa mga sanga. Kon magpabugal ka, dumduma nga indi ikaw ang nagasakdag sang gamut, kondi ang gamut nagasakdag sa imo.
Romans	11	19	Magasiling ka, “Ang mga sanga ginbanggi agud nga ako masumpay.”
Romans	11	20	Matuud ina. Bangud sang ila pagkadimatinoohon ginbanggi sila, apang ikaw nagatindug sing malig-on paagi lamang sa imo pagtoo. Gani dili ka magmatinaastaason, kondi magmahinadlukon.
Romans	11	21	Kay kon ang Dios wala magpaiway sa mga sanga nga unay, indi man sia magpaiway sa imo.
Romans	11	22	Niyan tan-awa ang pagkaayo kag ang pagkaid-id sang Dios: pagkaid-id sa mga nagkapukan, apang sa imo, ang pagkaayo sang Dios, kon magpadayon ka sa iya pagkaayo; kay kon indi ikaw man tapson.
Romans	11	23	Kag bisan ang iban, kon indi sila magpadayon sa ila pagkadimatinoohon, isumpay, kay ang Dios may gahum sa pagsumpay liwat sa ila.
Romans	11	24	Kay kon ikaw gin-utud nga sa kinaugali gikan sa olivo nga talonon, kag ginsumpay, batok sa kinaugali, sa maayong olivo, daw ano pa gid ini sila nga kinaugali nga mga sanga nga isumpay sa ila kaugalingon nga olivo.
Romans	11	25	Buut ko, mga kauturan, nga inyo mahibaloan ining tinago, basi kon magpakaalam kamo sa inyo kaugalingon nga hunahuna: ang pagpatig-a nag-abut sa bahin sang Israel, tubtub ang kabug-osan sang mga Gentil makasulud,
Romans	11	26	kag gani ang bug-os nga Israel maluwas; subong sang nasulat na, “Magagikan sa Sion ang Manluluwas, sia magapahilayo kay Jacob sang pagkadidiosnon”;
Romans	11	27	“kag ini amo ang akon katipan sa ila kon kuhaon ko ang ila mga sala.”
Romans	11	28	Nahanungud sa maayong balita mga kaaway sila sang Dios, tungud sa inyo; apang nahanungud sa pagpili mga hinigugma sila tungud sa ila mga ginikanan.
Romans	11	29	Kay ang mga dolot kag pagtawag sang Dios indi maliwat.
Romans	11	30	Kay subong nga kamo sa tion nga nagligad mga dimatinumanon sa Dios apang karon naka-agum sing kalooy bangud sa pagkadimatinumanon nila,
Romans	11	31	amo man ini sila karon mga dimatinumanon agud nga paagi sa kalooy nga ginpakita sa inyo sila man makaagum karon sing kalooy.
Romans	11	32	Kay ginpabayaan sang Dios ang tanan nga tawo sa pagkadimatinumanon, agud nga malooy sia sa tanan.
Romans	11	33	O pagkadalum sang kamanggaran kag kaalam kag ihibalo sang Dios! Pagkadimatungkad sang iya mga paghukom kag pagkadimausoy sang iya mga dalanon!
Romans	11	34	“Kay si sin-o bala ang nakahibalo sang hunahuna sang Ginoo, ukon sin-o bala ang nanginmanuglaygay niya?”
Romans	11	35	“Ukon sin-o bala ang nakahatag sa iya sing dolot agud nga mabayaran sia?”
Romans	11	36	Kay gikan sa iya kag paagi sa iya kag tungud sa iya ang tanan nga butang. Sa iya ang himaya sa gihapon. Kabay pa.
Romans	12	1	Busa ginapakilooy ko sa inyo, mga kauturan, bangud sang mga kalooy sang Dios, sa pagdolot sang inyo mga lawas subong nga halad nga buhi, balaan kag kalahamut-an sa Dios, nga amo ang inyo espirituhanon nga pagsimba.
Romans	12	2	Dili kamo magpauyon sa sining kalibutan kondi magbalhin kamo paagi sa pagbag-o sang inyo painoino, agud nga inyo matilawan kon ano ang maayo kag kalahamut-an kag himpit nga kabubut-on sang Dios.
Romans	12	3	Kay paagi sa bugay nga ginhatag sa akon nagasiling ako sa tagsa ka tawo nga yara sa inyo nga dili maghunahuna sang iya kaugalingon sing mataas pa sa dapat niya paghunahunaon, kondi maghunahuna sing but-anan, sono sa talaksan sang pagtoo nga ginbahin sang Dios sa tagsa ka tawo.
Romans	12	4	Kay subong nga may madamu kita nga bahin sa isa ka lawas, kag ang tanan nga bahin indi isa lamang sing hilikuton,
Romans	12	5	amo man kita, bisan madamu, isa ka lawas kay Cristo, kag ang tagsatagsa kabahin sang isa kag isa.
Romans	12	6	Sa may mga hiyas kita nga nagakatuhaytuhay sono sa bugay nga ginhatag sa aton, gamiton naton sila: kon sa pagpanagna, sono sa talaksan sang aton pagtoo;
Romans	12	7	kon sa pag-alagad, sa aton pag-alagad; ang nagapanudlo, sa iya pagpanudlo;
Romans	12	8	ang nagapanglaygay, sa iya pagpanglaygay; ang nagahatag, sa pagka-alwan; ang nagabulig, magmaukud; ang nagakalooy, magmalipayon.
Romans	12	9	Magdisalimpapaw ang gugma; kangil-ari ang malaut, magkapyot sing malig-on sa maayo;
Romans	12	10	sa gugma sang paghiliutud magmalolo kamo ang isa sa isa; sa kadungganan pasulabihon ang iban.
Romans	12	11	Magmakugihon, magmainit sa Espiritu, alagda ang Ginoo.
Romans	12	12	Magkalipay sa inyo paglaum, magpailub sa inyo kangitngitan, magpadayon sing malig-on sa pangamuyo.
Romans	12	13	Magbulig sa mga kinahanglanon sang mga balaan, magmaabiabihon.
Romans	12	14	Pakamaayoha ang mga nagahingabut sa inyo; magpakamaayo kag dili magpakalaut sa ila.
Romans	12	15	Magkalipay kaupud sang mga nagakalipay, maghibi kaupud sang mga nagahibi.
Romans	12	16	Mag-isa sing hunahuna; dili magmatinaastaason, kondi magbuylog sa mga kubus; dili magpakamaalam sa inyo kaugalingon nga hunahuna.
Romans	12	17	Dili magbayad sa bisan kay sin-o sing malaut sang malaut, apang maghimulat sang butang nga dungganon sa atubangan sang tanan nga tawo.
Romans	12	18	Kon mahimo, sa masarangan ninyo, magpakighidait sa tanan nga tawo.
Romans	12	19	Dili kamo magtimalus, mga hinigugma, kondi pabayai ini sa kasingkal sang Dios; kay nasulat na, “Akon ang pagtimalus, ako ang magatumbas, nagasiling ang Ginoo.”
Romans	12	20	Dili, “kon ang imo kaaway ginagutum, pakaona sia; kon ginauhaw sia, paimna sia; kay sa paghimo mo sini magatumpi ka sing mga baga sa iya olo.”
Romans	12	21	Dili magpadaug sa malaut, kondi dag-a ang malaut paagi sa maayo.
Romans	13	1	Ang tagsa ka tawo magpasakup sa pagbulut-an nga nagadumala. Kay walay pagbulut-an nga indi gikan sa Dios, kag ang karon nga mga pagbulut-an tinangdoan sang Dios.
Romans	13	2	Busa ang nagabato sa mga pagbulut-an nagasumpung sang pagsolondan sang Dios, kag ang mga nagasumpung magabaton sing paghukom.
Romans	13	3	Kay ang mga manugdumala indi kahadlukan sa buhat nga maayo, kondi sa malaut. Buut kamo bala nga indi mahadluk sa pagbulut-an? Niyan buhata ang maayo, kag may pagpakamaayo ka gikan sa iya,
Romans	13	4	kay sia alagad sang Dios nga sa imo kaayohan. Apang kon maghimo ka sing malaut, magkahadluk ka, kay wala sia nagadala sang espada sa walay pulus; alagad sia sang Dios sa paghikut sang kasingkal sa nagabuhat sing malaut.
Romans	13	5	Busa ang isa kinahanglan magpasakup, indi lamang sa paglikaw sang kasingkal sang Dios kondi man tungud sa kaisipan.
Romans	13	6	Kay sa sining kabangdanan nagabayad man kamo sing mga buhis, kay ang mga pagbulut-an mga alagad sang Dios, nga nagaatipan sa sini gid nga butang.
Romans	13	7	Bayari sila tanan sang natungud sa ila, mga buhis sa natungdan sang mga buhis, ang bayad sa balayran, pagtahud sa talahuron, dungug sa bagay pasidunggan.
Romans	13	8	Dili kamo mag-utang bisan kay sin-o, luwas sang paghigugmaanay; kay ang nagahigugma sa iya isigkatawo nakatuman sang kasogoan.
Romans	13	9	Ang mga sogo, “Dili ka magpanglahi, Dili ka magpatay, Dili ka magpangawat, Dili ka maghamkon, ” kag ang iban pa nga sogo, natingub sa sining polong, “Higugmaa ang imo isigkatawo subong sang imo kaugalingon.”
Romans	13	10	Ang gugma wala nagabuhat sing malain sa isigkatawo; busa ang gugma amo ang katumanan sang kasogoan.
Romans	13	11	Walay labut sini, nahibaloan ninyo ang takna, nga tion na ini nga inugmata ninyo sa katologon. Kay karon ang kaluwasan labing malapit na sa aton sang sa pagsugud ta pagtoo;
Romans	13	12	ang kagab-ihon manugtaliwan na, malapit na ang adlaw. Niyan isikway ta ang mga buhat sang kadudulman kag isuklub ang hinganib sang kapawa;
Romans	13	13	maggawi kita sing nagakaigo subong nga sa adlaw, indi sa magansal nga kinalipay kag paghinobog, indi sa patuyang kag kalaw-ayan, indi sa inaway kag pangimon.
Romans	13	14	Kondi isuklub ninyo si Ginoong Jesu-Cristo, kag dili kamo magpanigana nga sa unud, sa pagtuman sang mga kailigbon sini.
Romans	14	1	Batona ninyo ang tawong maluya sa pagtoo, apang indi sa pagpinuyas sa mga painoino.
Romans	14	2	Ang isa nagatoo nga makakaon sia sang bisan anong butang, samtang ang maluyang tawo nagakaon sing mga utan lamang.
Romans	14	3	Ang nagakaon indi magtamay sa wala nagakaon, kag ang wala nagakaon indi maghukom sa nagakaon; kay nabaton sia sang Dios.
Romans	14	4	Sin-o ka bala nga nagahukom sang alagad sang isa? Sa iya kaugalingon nga agalon nagatindug ukon nagakapukan sia. Kag patindugon sia, kay ang Ginoo may gahum sa pagpatindug sa iya.
Romans	14	5	Ang isa ka tawo nagakabig sang isa ka adlaw nga labaw sa isa, samtang ang isa nagakabig sing alangay sang tanan nga adlaw. Ang tagsa ka tawo maglig-on sing bug-os sa iya kaugalingon nga hunahuna.
Romans	14	6	Ang nagapakamahal sang adlaw, nagapakamahal sini sa Ginoo. Ang nagakaon man, nagakaon sa kadungganan sang Ginoo, kay nagapasalamat sia sa Dios; samtang ang wala nagakaon, wala nagakaon sa kadungganan sang Ginoo kag nagapasalamat sa Dios.
Romans	14	7	Walay bisan sin-o sa aton nga nagakabuhi sa iya kaugalingon, kag walay bisan sin-o nga nagakapatay sa iya kaugalingon.
Romans	14	8	Kon kita nagakabuhi, nagakabuhi kita sa Ginoo, kag kon kita nagakamatay, nagakamatay kita sa Ginoo; gani niyan, bisan kita nagakabuhi ukon nagakamatay, iya kita sang Ginoo.
Romans	14	9	Kay sa sining katuyoan napatay si Cristo kag nabuhi liwat, agud nga mangin-Ginoo sia sang mga patay kag sang mga buhi.
Romans	14	10	Ngaa bala nagahukom ka sa imo utud? Ukon ikaw, ngaa bala nagatamay ka sang imo utud? Kay tanan kita magaatubang sa lingkoran nga hukmanan sang Dios;
Romans	14	11	kay nasulat na, “Sa nagakabuhi ako, nagasiling ang Ginoo, magapilo ang tagsa ka tuhud sa akon, kag ang tagsa ka dila magadayaw sa Dios.”
Romans	14	12	Gani ang tagsatagsa sa aton magahatag sing husay sang iya kaugalingon sa Dios.
Romans	14	13	Niyan indi na kita maghinukmanay, kondi magtapat kita nga indi gid magbutang sing kasandaran ukon kasablagan sa dalanon sang iya utud.
Romans	14	14	Nakahibalo ako kag natalupangdan sa kay Ginoong Jesus nga walay bisan anong butang nga dimatinlo sa iya kaugalingon; kondi dimatinlo ini sa kay sin-o nga nagahunahuna nga ini dimatinlo.
Romans	14	15	Kon bangud sang imo ginakaon ang imo utud ginasub-an, wala ka na nagagawi sa gugma. Dili mo paglaglagon bangud sa imo ginakaon sia nga tungud sa iya napatay si Cristo.
Romans	14	16	Gani dili pag-ipahimalaut ang inyo maayo.
Romans	14	17	Kay ang ginharian sang Dios indi pagkaon kag pag-inum kondi pagkamatarung kag paghidait kag kalipay sa Espiritu Santo;
Romans	14	18	ang nagaalagad sing subong kay Cristo kalahamut-an sa Dios kag ginapakamaayo sang mga tawo.
Romans	14	19	Niyan sondon ta ang nagahimo nga sa paghidait kag sa pagpalig-on sa isa kag isa.
Romans	14	20	Dili paglaglaga, tungud sa pagkaon, ang buhat sang Dios. Ang tanan nga butang matuud matinlo, apang malaut sa tawo nga nagapasandad bangud sa iya ginakaon;
Romans	14	21	maayo nga indi magkaon sing unud ukon mag-inum sing alak ukon maghimo sing bisan ano nga nagapasandad sa imo utud ukon nagapasaklaw ukon nagapaluya .
Romans	14	22	Ang pagtoo nga yara sa imo, tipigi sa tunga sang imo kaugalingon kag sang Dios; malipayon ang wala nagahukom sa iya kaugalingon sa sina nga iya ginapakamaayo.
Romans	14	23	Apang ang nagaduhaduha ginatagudilian, kon magkaon sia, bangud nga nagakaon sia nga indi gikan sa pagtoo; kay ang bisan ano nga indi gikan sa pagtoo sala.
Romans	15	1	Kita nga mabakud dapat magdala sang mga kaluyahon sang mga maluya, kag dili magpahamuut sa aton kaugalingon;
Romans	15	2	ang tagsa sa aton magpahamuut sa iya isigkatawo sa maayo, sa pagpalig-on sa iya.
Romans	15	3	Kay si Cristo wala magpahamuut sa iya kaugalingon; kondi, sono sa nasulat na, “Ang mga pasipala sang mga nagpasipala sa imo nagtupa sa akon.”
Romans	15	4	Kay ang bisan ano nga nasulat sadto anay ginsulat sa pagtudlo sa aton, agud nga paagi sa pagkalig-on kag pagpabakud sang mga kasulatan may paglaum kita.
Romans	15	5	Ang Dios sang pagkalig-on kag pagkabakud magtugut sa inyo nga mangin-isa kamo sing hunahuna sa isa kag isa, sono kay Cristo Jesus,
Romans	15	6	agud nga sa tingub mahimaya ninyo sa isa ka tingug ang Dios kag Amay sang aton Ginoong Jesu-Cristo.
Romans	15	7	Busa magbinatonay kamo, subong nga si Cristo man nagbaton sa inyo, nga sa himaya sang Dios.
Romans	15	8	Kay nagasiling ako sa inyo nga si Cristo nahimo nga alagad sa nacircuncidar sa pagpakita sang pagkamaminatud-on sang Dios, agud nga mapamatud-an niya ang mga saad sa mga patriarca,
Romans	15	9	kag agud nga ang mga Gentil maghimaya sa Dios tungud sang iya kalooy. Subong sang nasulat na, “Busa magadayaw ako sa imo sa tunga sang mga Gentil, kag magaamba sa imo ngalan”,
Romans	15	10	kag liwat ginasiling, “Magkalipay, kamo nga mga Gentil, kaupud sang iya katawohan”;
Romans	15	11	kag liwat, “Dayawa ang Ginoo, tanan nga Gentil, kag magdayaw ang tanan nga katawohan sa iya”;
Romans	15	12	kag liwat si Isaias nagsiling, “Magalutaw ang gamut ni Jese, sia nga nagatindug sa paggahum sa mga Gentil; sa iya ang mga Gentil magalaum.”
Romans	15	13	Kabay ang Dios sang paglaum magpuno sa inyo sing bug-os nga kalipay kag paghidait sa pagtoo, agud nga magbugana kamo sa paglaum sa gahum sang Espiritu Santo.
Romans	15	14	Ako contento nahanungud sa inyo, mga kauturan, nga kamo gid napun-an sang pagkaayo, napun-an sang bug-os nga ihibalo, kag sarang sa paglinaygayay.
Romans	15	15	Apang nagasulat ako sa inyo sing masidla pa sa iban nga bahin sa pagpahanumdum sa inyo, bangud sang bugay nga ginhatag sa akon sang Dios
Romans	15	16	nga mangin-alagad ako ni Jesu-Cristo sa mga Gentil sa sinacerdote nga panghikot sang maayong balita sang Dios, agud nga ang paghalad sang mga Gentil manginkalahamut-an, nga ginpakabalaan sang Espiritu Santo.
Romans	15	17	Niyan sa kay Cristo Jesus may akon ako nga pagpabugal sang akon buluhaton nahanungud sa Dios.
Romans	15	18	Kay indi ako magpangahas sa paghambal sang bisan ano luwas sadto nga nahimo ni Cristo paagi sa akon nga sa pagpatuman sang mga Gentil, paagi sa polong kag buhat,
Romans	15	19	sa gahum sang mga tanda kag kalatingalahan, sa gahum sang Espiritu Santo, sa bagay nga kutub sa Jerusalem kag sa palibut tubtub sa Ilirico nawali ko sing bug-os ang maayong balita ni Cristo,
Romans	15	20	sa amo ginahimo ko nga akon katuyoan ang pagwali sang maayong balita, indi sa diin si Cristo nahingadlan na, agud nga indi ako magtukud sa ibabaw sang sadsaran sang iban,
Romans	15	21	apang subong sang nasulat na, “Sila nga wala maabuti sang maayong balita nahanungud sa iya makakita, kag ang mga wala makabati makahangup.”
Romans	15	22	Amo ini ang kabangdanan nga sa masunsun nasablagan ako sa pagkara sa inyo.
Romans	15	23	Apang karon, sanglit nga wala na ako sing duug nga pangabudlayan sa sining kadutaan, kag sanglit nga nagahandum ako sa pagkara sa inyo sa sining madamu nga tuig,
Romans	15	24	nagalaum ako sa pagpakigkita sa inyo sa akon pag-agi pakadto sa España, kag pagpatigayonon ako ninyo sa akon pagpakadto didto, kon nakapangalipay na ako sing malip-ot kaupud ninyo.
Romans	15	25	Apang karon, nagapakadto ako sa Jerusalem nga nagadala sing bulig sa mga balaan.
Romans	15	26	Kay nahamut-an sang Macedonia kag Acaya ang pag-amut tungud sa mga imol sa mga balaan sa Jerusalem;
Romans	15	27	nahamut-an nila ang paghimo sini, kag sila sa pagkamatuud may utang sa ila, kay kon ang mga Gentil nangin-umalambit sang mga kabulahanan nila nga espirituhanon, dapat man sila mag-alagad sa ila sa mga kabulahanan nga lawasnon.
Romans	15	28	Busa kon matapus ko ini, kag mahatag sa ila ang natipon, magaagi ako dira sa inyo pa España;
Romans	15	29	kag nahibaloan ko nga kon magkara ako sa inyo magakara ako sa kabug-osan sang pagpakamaayo ni Cristo.
Romans	15	30	Ginapakilooy ko sa inyo, mga kauturan, bangud sa aton Ginoong Jesu-Cristo kag bangud sa gugma sang Espiritu, nga magpanikasug kamo sing tingub kaupud nakon sa inyo mga pangamuyo sa Dios tungud sa akon,
Romans	15	31	agud nga maluwas ako sa mga dimatinoohon sa Judea, kag ang akon pagpanghikot tungud sa Jerusalem mahamut-an sa mga balaan,
Romans	15	32	agud nga magakara ako sa inyo sa kalipay paagi sa kabubut-on sang Dios kag makapahuway kaupud ninyo.
Romans	15	33	Ang Dios sang paghidait manginkaupud ninyo nga tanan. Kabay pa.
Romans	16	1	Ginapakilala ko sa inyo ang aton utud nga babayi nga si Febe, nga diaconisa sang iglesia sa Cencreas,
Romans	16	2	nga batonon ninyo sia sa Ginoo nga nagakaigo sa mga balaan, kag nga inyo sia buligan sa bisan ano nga may kinahanglan sia sa inyo, kay sia gid mabinuligon sa madamu kag sa akon kaugalingon man.
Romans	16	3	Abiabiha ninyo si Priscila kag si Aquila, nga akon mga masigkamanugpangabudlay kay Cristo Jesus,
Romans	16	4	nga tungud sa akon kabuhi ginpakatalagman nila ang ila kaugalingon nga kabuhi, kag indi lamang ako ang nagapasalamat sa ila kondi man ang tanan nga iglesia sang mga Gentil;
Romans	16	5	abiabiha man ang iglesia nga yara sa ila balay. Abiabiha ang akon hinigugma nga si Epeneto, nga amo ang nahauna nga pinaliso sa Asia kay Cristo.
Romans	16	6	Abiabiha si Maria, nga nagpangabudlay sing madamu sa inyo.
Romans	16	7	Abiabiha si Andronico kag si Junia, nga akon mga himata kag mga masigkabinilanggo ko; bantug sila nga mga tawo sa mga pinadala, nga sila man kay Cristo una sa akon.
Romans	16	8	Abiabiha si Amplias, nga hinigugma ko sa Ginoo.
Romans	16	9	Abiabiha si Urbano, nga aton masigkamanugpangabudlay kay Cristo, kag ang akon hinigugma nga si Staquis.
Romans	16	10	Abiabiha si Apeles, nga kalahamut-an kay Cristo. Abiabiha ang mga sa panimalay ni Aristobulo.
Romans	16	11	Abiabiha si Herodion nga akon himata. Abiabiha ang mga sa panimalay ni Narciso, nga yara sa Ginoo.
Romans	16	12	Abiabiha si Trifena kag si Trifosa, nga nagapangabudlay sa Ginoo. Abiabiha ang hinigugma nga si Persida, nga nagpangabudlay sing daku sa Ginoo.
Romans	16	13	Abiabiha si Rufo nga pinili sa Ginoo, kag ang iya iloy kag akon.
Romans	16	14	Abiabiha si Asincrito, si Flegonte, si Hermes, si Patrobas, si Hermas, kag ang mga kauturan nga kaupud nila.
Romans	16	15	Abiabiha si Filologo, si Julia, si Nereo kag ang iya utud nga babayi, kag si Olimpas, kag ang tanan nga balaan nga kaupud nila.
Romans	16	16	Mag-abiabihay kamo nga may balaan nga haluk. Nagaabiabi sa inyo ang tanan nga iglesia ni Cristo.
