Book	Chapter	Verse	Text
Zephaniah	1	1	Ang polong sang Ginoo nga nag-abut kay Sofonias nga anak ni Cusi, ang anak ni Gedalias, ang anak ni Amarias, ang anak ni Ezequias, sa mga adlaw ni Josias nga anak ni Amon, hari sang Juda.
Zephaniah	1	2	“Papason ko sing bug-os ang tanan nga butang sa kadaygan sang duta,” nagasiling ang Ginoo .
Zephaniah	1	3	“Papason ko ang tawo kag sapat; papason ko ang kapispisan sang mga langit kag ang kaisdaan sang dagat. Landason ko ang mga malauton; utdon ko ang tawo gikan sa kadaygan sang duta,” nagasiling ang Ginoo .
Zephaniah	1	4	“Untayon ko ang akon kamut batok sa Juda, kag sa tanan nga mga pumuluyo sang Jerusalem; kag papason ko sa sining duug ang nabilin ni Baal kag ang ngalan sang diwatahan nga mga sacerdote;
Zephaniah	1	5	ang mga nagasimba sang kasoldadosan sang langit sa mga atop; ang mga nagasimba kag nagasumpa sa Ginoo kag walay sapayan nagasumpa kay Malcam;
Zephaniah	1	6	ang mga nagatalikod gikan sa pagsonod sa Ginoo , nga wala nagapangita sa Ginoo ukon nagpamangkot sa iya.”
Zephaniah	1	7	Hipus ka sa atubangan sang Ginoong Dios ! Kay ang adlaw sang Ginoo malapit na; ang Ginoo nakaaman sing halad kag nakapakabalaan sang iya mga inagda.
Zephaniah	1	8	Kag sa adlaw sang halad sang Ginoo —“Silotan ko ang mga principe kag ang mga anak nga lalaki sang hari kag ang tanan nga napanaptan sing panapton nga dumuloong.
Zephaniah	1	9	Sa sadtong adlaw silotan ko ang tanan nga nagaliktin sa atangan, kag ang nagapuno sang balay sang ila agalon sing panglugus kag paglimbong.”
Zephaniah	1	10	“Sa sadtong adlaw,” nagasiling ang Ginoo , “mabatian ang sininggit gikan sa Gawang sang Isda, paghaya gikan sa Ikaduha nga Ikap-at nga Bahin, ang dakung huganas gikan sa kabakoloran.
Zephaniah	1	11	Haya, O mga pumuluyo sang Manubo nga Banwa! Kay ang tanan nga katawohan sang Canaan nawala; tanan nga nalulanan sing pilak napapas.
Zephaniah	1	12	Sa sadtong tion usisaon ko nga may mga sulu ang Jerusalem, kag silotan ko ang mga tawo nga yara sa ila mga lagdo, nga nagasiling sa ila tagiposoon, ‘Ang Ginoo indi maghimo sing maayo, ukon maghimo sia sing malaut.’
Zephaniah	1	13	Ang ila manggad mangin-inatihan, kag ang ila mga balay manginmamingaw. Bisan magapatindug sila sing mga balay, indi sila makapuyo sa ila; bisan magatanum sila sing mga ulubasan, indi makainum sila sang alak nila.”
Zephaniah	1	14	Malapit na ang dakung adlaw sang Ginoo , malapit ini kag nagadalidali sing tama; ang tingug sang adlaw sang Ginoo mapait, ang gamhanan nga lalaki nagasinggit sing didto.
Zephaniah	1	15	Yadtong adlaw amo ang adlaw sang kasingkal, adlaw sang kagamo kag kalisud, adlaw sang kalaglagan kag kamingaw, adlaw sang kadudulman kag kaguum, adlaw sang mga gal-um kag pitipit nga kadudulman,
Zephaniah	1	16	adlaw sang budyong kag paandam batok sa mga banwa nga napamakuran kag batok sa mataas nga mga torre.
Zephaniah	1	17	Dalhon ko ang kalisud sa mga tawo, agud nga maglakat sila kaangay sang mga tawong bulag, bangud nga nakasala sila batok sa Ginoo ; ang dugo nila ulaon subong sang yab-ok, kag ang ila unud subong sang ipot.
Zephaniah	1	18	Bisan ang ila pilak ukon ang ila bulawan indi sarang makaluwas sa ila sa adlaw sang kasingkal sang Ginoo . Ang bug-os nga duta halunhonon sang kalayo sang iya kaimon; kay ang bug-os, hoo, ang hinali nga pagtapus himoon niya sa tanan nga nagapuyo sa duta.
Zephaniah	2	1	Tilipon kamo sing tingub kag magsinapul, O pungsud nga walay huya,
Zephaniah	2	2	sa wala pa matabog kamo, subong sang labhang, sa wala pa mag-abut sa inyo ang mapintas nga kaakig sang Ginoo , sa wala pa mag-abut sa inyo ang adlaw sang kaakig sang Ginoo .
Zephaniah	2	3	Pangitaa ninyo ang Ginoo , kamo tanan nga mapainubuson sang duta, nga nagbantay sang iya mga pagsolondan; pangitaa ang pagkamatarung, pangitaa ang pagkamapinaubuson; ayhan malipdan kamo sa adlaw sang kaakig sang Ginoo .
Zephaniah	2	4	Kay ang Gasa bayaan, kag ang Ascalon manginmamingaw; ang katawohan sang Asdod tabogon sa kaodtohon. kag ang Ecron gabuton.
Zephaniah	2	5	Kailo ang mga pumuluyo sang baybayon, ang pungsud sang mga Ceretnon! Ang polong sang Ginoo batok sa inyo, O Canaan, duta sang mga Filistinhon; kag laglagon ko ikaw agud nga wala na sing pumuluyo.
Zephaniah	2	6	Kag ikaw, O baybayon, manginhalalban, mga wayang sang mga manugpahalab kag mga toril sang mga panong.
Zephaniah	2	7	Ang baybayon manginpagkabutang sang nabilin sang panimalay sang Juda, diin magapahalab sila, kag sa mga balay sang Ascalon magahigda sila sa kagab-ihon. Kay duawon sila sang Ginoo nga ila Dios kag magapahauli sang ila kabihagan.
Zephaniah	2	8	“Nabatian ko ang pagpakahuya sang Moab kag ang mga pagbuyayaw sang mga anak ni Amon, nga ginpakahuya nila sa akon katawohan kag nagpakadaku sang ila kaugalingon batok sa ila dulunan.
Zephaniah	2	9	Busa, sa nagakabuhi ako,” nagasiling ang Ginoo sang mga kasoldadosan, ang Dios sang Israel, “Ang Moab manginsubong sang Sodoma, kag ang mga anak ni Amon subong sang Gomorra, duta nga kaugalingon sang katunukan kag mga awang sang asin, kag dayon nga kamingaw. Ang salin sang akon katawohan magaagaw sa ila, kag ang nabilin sang akon pungsud magapanubli sa ila.”
Zephaniah	2	10	Ini agumon nila tungud sang ila pagpabugal, bangud nga nagpakahuya kag nagpakadaku sila batok sa katawohan sang Ginoo sang mga kasoldadosan.
Zephaniah	2	11	Ang Ginoo manginmakakulugmat sa ila; hoo, pagutuman niya ang tanan nga dios sang duta, kag ang mga tawo magasimba sa iya, ang tagsatagsa sa iya duug, ang tanan nga kapuloan sang mga pungsud.
Zephaniah	2	12	Kamo man, O mga Etiopiahanon, patyon kamo sang akon espada.
Zephaniah	2	13	Kag untayon niya ang iya kamut batok sa aminhan, kag laglagon ang Asiria; kag himoon nga mamingaw ang Ninive, nga mamala kaangay sang kamingawan.
Zephaniah	2	14	Ang kabakahan magaluko sa tunga niya, ang tanan nga kasapatan sang mga pungsud; ang pelicano kag ang porcupino magaholon sa iya mga oloolo; ang ila tingug magaamba sa mga talambuan, ang kamingaw manginsa mga atangan; kay iya ginhublasan ang mga binuhat nga cedro.
Zephaniah	2	15	Amo ini ang banwa nga malipayon nga nagpuyo sing patarasak, nga nagsiling sa iya tagiposoon, “Ako lamang kag wala na sing iban luwas sa akon.” Daw ano nga nagmingaw sia, isa ka duug nga lulukhan sang kasapatan! Ang tagsatagsa nga nagalabay sa iya magapanagutsut kag magabalabad sang iya kamut.
Zephaniah	3	1	Kailo sa iya nga mabinatoon kag dinagtaan, sa mapiguson nga banwa!
Zephaniah	3	2	Wala sia magtuman sang tingug, wala sia magbaton sang pagtudlo. Wala sia magsalig sa Ginoo , wala sia magpalapit sa iya Dios.
Zephaniah	3	3	Ang iya mga principe sa tunga niya mga leon nga nagangurab; ang iya mga hukom mga lobo sa kagab-ihon nga wala sila sing ginabilin tubtub sa aga.
Zephaniah	3	4	Ang iya mga manalagna mga huroshuros, mabudhion nga mga tawo; ang iya mga sacerdote nagpasipala sang santuario, ginlugus nila ang kasogoan.
Zephaniah	3	5	Ang Ginoo matarung sa tunga niya, wala sia maghimo sing kalautan; sa tagsa ka aga ginapasiga niya ang iya katarungan, wala sia nagapalangan; apang ang dimatarung wala makakilala sing kahuya.
Zephaniah	3	6	“Ginpapas ko ang mga pungsud; ang ila mga torre mamingaw; ginguba ko ang ila mga dalan sa bagay nga wala na sing nagaagi; ang ila mga banwa nalaglag, sa bagay nga wala na sing tawo, nga wala na sing pumuluyo.
Zephaniah	3	7	Nagsiling ako, ‘Lamang magkahadluk ka sa akon, magbaton ka sing pagtudlo; agud nga ang iya puluy-an indi mapapas sono sa tanan nga gintangdo ko nahanungud sa iya.’ Apang nagbangon sila sing aga pa sa pagpadunut sang tanan nila nga hinimoan.”
Zephaniah	3	8	“Busa hulata ninyo ako,” nagasiling ang Ginoo , “tubtub sa adlaw nga magtindug ako sa inagaw. Kay ang akon pagtapat amo ang pagtipon sang mga pungsud, agud nga matingub ko ang mga ginharian, sa pag-ula sa ila sang akon kaalipungut, ang bug-os kong mapintas nga kaakig; kay ang bug-os nga duta lamonon sang kalayo sang akon kaimon.
Zephaniah	3	9	“Hoo, niyan palisoon ko sa mga katawohan ang putli nga bibig, agud nga sila tanan magtawag sa ngalan sang Ginoo sa pag-alagad sa iya sa isa ka paghilisugut.
Zephaniah	3	10	Gikan sa tabok sang mga suba sang Etiopia ang akon mga manugsimba, ang babayi nga anak sang akon ginpaaplaag, magadala sang akon dolot.
Zephaniah	3	11	“Sa sadtong adlaw indi ka pagpakahuy-an bangud sang tanan mo nga hinimoan diin naglalis ka sa akon; kay niyan kuhaon ko sa tunga nimo ang imo palabilabihon nga mga matinaastaason, kag indi ka na magpalabilabihon sa akon balaan nga bukid.
Zephaniah	3	12	Kay magabilin ako sa tunga nimo sing katawohan nga napiotan kag makalolooy. Sila magadangup sa ngalan sang Ginoo ,
Zephaniah	3	13	ang nabilin sang Israel; indi sila maghimo sing kalautan ukon magpamolong sing kabutigan, kag ang malimbongon nga dila indi makita sa ila baba. Kay sila magahalab kag magaluko, kag wala gid sing magapahadluk sa ila.”
Zephaniah	3	14	Hugyaw, O babayi nga anak sang Sion; singgit, O Israel! Magkasadya kag magkalipay sa bug-os mong tagiposoon, O babayi nga anak sang Jerusalem!
Zephaniah	3	15	Ang Ginoo nagkuha sang imo mga paghukom, ginsobol niya ang imo mga kaaway. Ang Hari sang Israel, ang Ginoo , yara sa tunga nimo; dili ka na magkahadluk sing malaut.
Zephaniah	3	16	Sa sadtong adlaw isiling sa Jerusalem: “Dili magkahadluk, O Sion; dili magluya ang imo mga kamut.
Zephaniah	3	17	Ang Ginoo , ang imo Dios, yara sa tunga nimo, ang gamhanan nga magaluwas; magakasadya sia sa imo nga may kalipay, magapahuway sia sa iya gugma; magakalipay sia sa imo nga may inamba
Zephaniah	3	18	subong nga sa adlaw sang kinasadya. “Kuhaon ko ang kalaglagan gikan sa imo, agud nga indi ikaw magdala sang kahuluy-an tungud sini.
Zephaniah	3	19	Yari karon, sa sadtong tion magahisayo ako sa tanan nga nagapapiot sa imo. Kag luwason ko ang piang kag tiponon ang ginsobol, kag himoon ko sila nga pagdayaw kag ngalan nga ang ila kahuluy-an naglapnag sa bug-os nga duta.
Zephaniah	3	20	Sa sadtong tion papaulion ko kamo, sa sadtong tion tiponon ko kamo; kay himoon ko kamo nga ngalan kag pagdayaw sa tunga sang tanan nga mga katawohan sang duta, kon pahaulian ko ang inyo kabihagan sa atubangan sang inyo mga mata,” nagasiling ang Ginoo .
Zechariah	1	1	Sa ikawalong bulan, sa ikaduha nga tuig ni Dario, nag-abut ang polong sang Ginoo kay Zacarias nga anak ni Berequias, ang anak ni Iddo, ang manalagna, nga nagasiling,
Zechariah	1	2	“Ang Ginoo naakig sing tama sa inyo mga ginikanan.
Zechariah	1	3	Busa isiling mo sa ila, Amo ini ang ginasiling sang Ginoo sang mga kasoldadosan: Balik kamo sa akon, nagasiling ang Ginoo sang mga kasoldadosan, kag ako magabalik sa inyo, nagasiling ang Ginoo sang mga kasoldadosan.
Zechariah	1	4	Dili kamo magsubong sa inyo mga ginikanan, nga sa ila nagsinggit ang una nga mga manalagna, ‘Amo ini ang ginasiling ang Ginoo sang mga kasoldadosan, Talikod kamo karon sa inyo malaut nga mga dalanon kag sa inyo malaut nga mga buhat.’ Apang wala sila magpamati ukon magtalupangud sa akon, nagasiling ang Ginoo .
Zechariah	1	5	Ang inyo mga ginikanan, diin na bala sila? Kag ang mga manalagna, nagakabuhi sila bala sing dayon?
Zechariah	1	6	Apang ang akon mga polong kag ang akon mga palatukuran, nga ginsogo ko sa akon mga alagad nga mga manalagna, wala bala nila malambut ang inyo mga ginikanan? Gani nagbalik sila kag nagsiling, Sono sa ginahinyo sang Ginoo sang mga kasoldadosan nga himoon sa aton sono sa aton mga dalanon kag mga binuhatan, amo ini ang paghisayo niya sa aton.”
Zechariah	1	7	Sa ikaduha ka pulo kag apat nga adlaw sang bulan nga ikapulog isa nga amo ang bulan nga Sebat, sa ikaduhang tuig ni Dario, nag-abut ang polong sang Ginoo kay Zacarias nga anak ni Berequias, ang anak ni Iddo, ang manalagna; kag si Zacarias nagsiling,
Zechariah	1	8	“Nakita ko sa kagab-ihon, kag yari karon, isa ka lalaki nga nagasakay sa kabayo nga mapula! Nagdolog sia sa tunga sang mga mirto nga yara sa ubus; kag sa olihi niya may mapula, badyaw, kag maputi nga mga kabayo.
Zechariah	1	9	Niyan nagsiling ako, ‘Ginoo ko, ano bala ini sila?’ Ang manugtunda nga nagpakighambal sa akon nagsiling sa akon, ‘Ipakita ko sa imo kon ano ini sila.’
Zechariah	1	10	Gani ang lalaki nga nagdolog sa tunga sang mga mirto nagsabat, ‘Ini sila amo ang ginpadala sang Ginoo sa paglibud sa duta.’
Zechariah	1	11	Kag sila nagsabat sa manugtunda sang Ginoo nga nagdolog sa tunga sang mga mirto, ‘Ginlibud namon ang duta, kag yari karon, ang bug-os nga duta matinong, kag nagapahuway.’
Zechariah	1	12	Niyan ang manugtunda sang Ginoo nagsabat, ‘O Ginoo sang mga kasoldadosan, tubtub pa bala san-o nga indi ka magkalooy sa Jerusalem kag sa kabanwaanan sang Juda, nga batok sa ila naalipungut ka sini nga kapitoan ka tuig?’
Zechariah	1	13	Kag ang Ginoo nagsabat sa manugtunda nga nagpakighambal sa akon sa maayo kag makalilipay nga mga polong.
Zechariah	1	14	Gani ang manugtunda nga nagpakighambal sa akon nagsiling sa akon, ‘Singgit ka, Amo ini ang ginasiling sang Ginoo sang mga kasoldadosan: Nagakaimon ako sa Jerusalem kag sa Sion sa daku nga kaimon.
Zechariah	1	15	Kag nagakaakig ako sing tama gid sa mga pungsud nga yara sa katawhay; kay naakig ako lamang sing diotay kag nagbulig sila sa pagpadayon sang kapipit-an.
Zechariah	1	16	Busa, amo ini ang ginasiling sang Ginoo , nagabalik ako sa Jerusalem nga may mga kalooy; patindugon sa iya ang akon balay, nagasiling ang Ginoo sang mga kasoldadosan, kag ang latid untayon sa ibabaw sang Jerusalem.
Zechariah	1	17	Singgit pa liwat, Amo ini ang ginasiling sang Ginoo sang mga kasoldadosan: Ang akon kabanwaanan magaawas pa sa kauswagan, kag lipayon pa sang Ginoo ang Sion kag pilion pa ang Jerusalem.’”
Zechariah	1	18	Kag ginbayaw ko ang akon mga mata kag nakakita, kag yari karon, ang apat ka sungay!
Zechariah	1	19	Kag nagsiling ako sa manugtunda nga nagpakighambal sa akon, “Ano bala ini sila?” Kag nagsabat sia sa akon, “Ini sila amo ang mga sungay nga nagpaaplaag sang Juda, sang Israel, kag sang Jerusalem.”
Zechariah	1	20	Niyan ginpakitaan ako sang Ginoo sing apat ka manugsalsal.
Zechariah	1	21	Kag nagsiling ako, “Ano bala ang ginakari nila sini nga himoon?” Nagpamolong sia, “Ini sila amo ang mga sungay nga nagpaaplaag sang Juda, sa bagay nga wala sing tawo nga nagtukhayaw sang iya olo; apang ini sila nagkari sa pagpakugmat sa ila, sa pagpungal sang mga sungay sang mga pungsud nga nagbayaw sang ila sungay batok sa duta sang Juda sa pagpaaplaag sa iya.”
Zechariah	10	1	Pangayo kamo sa Ginoo sing ulan sa tion sang olihi nga ulan, sa Ginoo nga nagahimo sing mga kilat, nga hatagan niya sila sing nagabonok nga ulan, sa tagsatagsa sing hilamon sa latagon.
Zechariah	10	2	Kay ang mga terafim nagpamolong sa wala sing pulus, kag ang mga manugpakot nakakita sing kabutigan; nagsugid sila sing dimatuud nga mga damgo, kag nagalipay sila sa wala sing pulus. Busa nagalakat ang katawohan sa ila dalanon kaangay sang mga carnero; ginapiotan sila bangud nga wala sing manugpahalab.
Zechariah	10	3	“Nagdabdab ang akon kaakig batok sa mga manugpahalab, kag silotan ko ang mga kanding nga lalaki; kay ang Ginoo sang mga kasoldadosan nagduaw sa iya panong, ang panimalay sang Juda, kag himoon sila subong sang iya ali nga kabayo sa inaway.
Zechariah	10	4	Sa iya magagowa ang bato sang pamag-ang, sa iya ang lansang, sa iya ang pana sa inaway, sa iya ang tagsa ka manugdumala sing tingub.
Zechariah	10	5	Manginsubong sila sang gamhanan nga mga tawo, nga nagatapak sang ila mga kaaway sa lunang sang mga alagyan sa inaway; magaaway sila bangud nga ang Ginoo nagaupud sa ila, kag ang mga manugsakay sa mga kabayo maorongan.
Zechariah	10	6	“Palig-onon ko ang panimalay sang Juda, kag luwason ko ang panimalay ni Jose. Pabalikon ko sila kay nalooy ako sa ila, kag sila manginsubong sang wala ko masobol sila; kay Ako amo ang Ginoo nga ila Dios kag magapamati ako sa ila.
Zechariah	10	7	Niyan ang mga sa Efraim manginkaangay sang gamhanan nga tawo, kag ang ila tagiposoon magakasadya subong sang sa alak. Ang ila mga anak makakita sini kag magakasadya, ang ila mga tagiposoon magakalipay sa Ginoo .
Zechariah	10	8	“Ako magapanagutsut tungud sa ila kag tiponon sila, kay gintubus ko sila, kag magadugang sila subong sang una.
Zechariah	10	9	Kon isab-ug ko sila sa tunga sang mga katawohan, walay sapayan dumdumon nila ako sa malayo nga kadutaan, kag magakabuhi sila upud sang ila mga anak kag magabalik.
Zechariah	10	10	Pabalikon ko sila liwat man gikan sa duta sang Egipto, kag tiponon sila gikan sa Asiria; kag pasudlon ko sila sa duta sang Galaad kag Libano, tubtub nga wala sing duug nga makita tungud sa ila.
Zechariah	10	11	Magaagi sia sa dagat sang kapipit-an, kag magahampak sang mga balud sa dagat, kag magamala ang bug-os nga kadadalman sang Nilo. Ang bugal sang Asiria paubson, kag ang cetro sang Egipto magataliwan.
Zechariah	10	12	Palig-onon ko sila sa Ginoo kag magalakat sila paibabaw kag paubus sa iya ngalan,” nagasiling ang Ginoo .
Zechariah	11	1	Buksi ang imo mga ganhaan, O Libano, agud nga ang kalayo makalamon sang imo mga cedro!
Zechariah	11	2	Maghaya, O abeto, kay napukan ang cedro, bangud nga ang mga ali nalaglag! Maghaya, O kamo nga mga roble sang Basan, kay ang mabakud nga talon natup-ay!
Zechariah	11	3	Ang tingug sang hinaya sang mga manugpahalab, kay ang ila himaya nalaglag! Ang tingug sang pagngurub sang magamay nga mga leon, kay ang bugal sang Jordan nawagwag!
Zechariah	11	4	Amo ini ang ginsiling sang Ginoo nga akon Dios: “Pahalba ang panong nga ilihawon.
Zechariah	11	5	Ginaihaw sila sang ila mga tag-iya kag nagapakawala sila sing sala; kag ang mga nagabaligya sa ila nagasiling, ‘Pagpakamaayohon ang Ginoo , kay manggaranon ako’; kag ang ila mga manugpahalab wala nagakaawa sa ila.
Zechariah	11	6	Kay indi na ako magkaawa sa mga pumuluyo sang duta, nagasiling ang Ginoo . Yari karon, ako magatugyan sang mga tawo ang tagsatagsa sa kamut sang iya isigkatawo, kag sa kamut sang iya hari; kag samaron nila ang duta, kag ako indi magluwas sa ila gikan sa ila kamut.”
Zechariah	11	7	Gani ginpahalab ko ang panong nga ilihawon nga mga makalolooy gid sang panong. Kag nagkuha ako nga sa akon sing duha ka sungkod; ang isa ginhingalanan ko Katahum, ang isa ginhingalanan ko nga Bugkos. Kag ginpahalab ko ang panong.
Zechariah	11	8	Ginpapas ko ang tatlo ka manugpahalab sa isa ka bulan. Kay ang akon kalag natak-an sa ila, kag ang kalag nila man nangil-ad sa akon.
Zechariah	11	9	Niyan nagsiling ako, “Indi na ako magpahalab sa inyo. Ang mapatay, pakamatya; ang palapason, ipapapas; kag ang mga mabilin magkan-anay sang unud sang isa kag isa.”
Zechariah	11	10	Kag ginkuha ko ang akon sungkod nga Katahum, kag gin-utud, agud nga mabungkag ko ang akon katipan nga ginhimo ko sa tanan nga mga katawohan.
Zechariah	11	11	Gani gin-utud ini sa sadtong adlaw, kag sa sini ang makalolooy sang panong, nga nagpamati sa akon, nakahibalo nga yadto polong sang Ginoo .
Zechariah	11	12	Niyan nagsiling ako sa ila, “Kon ginapakamaayo ninyo, hatagi ako sang akon sohol; kag kon indi, pabayai.” Gani nagtimbang sila nga sa akon sohol sing katloan ka bilog nga pilak.
Zechariah	11	13	Niyan nagsiling sa akon ang Ginoo , “Ipilak ini sa maninihon”—ang maayo nga bili nga ginpabili nila sa akon. Gani ginkuha ko ang katloan ka bilog nga pilak kag ginpilak sila sa maninihon sa balay sang Ginoo .
Zechariah	11	14	Niyan gin-utud ko ang akon isa pa ka sungkud nga Bugkos, agud nga mabungkag ko ang paghiliutud sa tunga sang Juda kag Israel.
Zechariah	11	15	Niyan nagsiling sa akon ang Ginoo , “Kuha ka liwat sang mga gamit sang manugpahalab nga buangbuang.
Zechariah	11	16	Kay yari karon, magabangon ako sing manugpahalab sa duta nga indi magtatap sang mga nawala, ukon magpangita sang nagdalangdalang, ukon magbolong sang nabali, ukon magpahalab sang maayo, kondi kaonon niya ang unud sang matambok, kag magapihak sang ila mga koko.
Zechariah	11	17	Kailo ang manugpahalab nga wala sing pulus, nga nagabiya sang panong! Ang espada manginsa iya butkon sa iya mata nga too! Ang iya butkon maitus gid, ang iya mata nga too magadulum sing bug-os!”
Zechariah	12	1	Ang lulan sang polong sang Ginoo nahanungud sa Israel: Amo ini ang ginasiling sang Ginoo , nga nagahumlad sang mga langit kag nagapasad sang sadsaran sang duta kag nagahuman sang espiritu sang tawo sa sulud niya:
Zechariah	12	2	“Yari karon himoon ko ang Jerusalem nga tagayan sang pagdulingduling sa tanan nga mga katawohan sa palibut; sa Juda man manginyari ini sa pagkibon sang Jerusalem.
Zechariah	12	3	Sa sadtong adlaw himoon ko ang Jerusalem nga mabug-at nga bato sa tanan nga mga katawohan; ang tanan nga magapabug-at sa ila sini mapilas sing tama. Kag ang tanan nga mga pungsud sang duta magatipon sing tingub batok sini.
Zechariah	12	4	Sa sadtong adlaw, nagasiling ang Ginoo , pakugmaton ko ang tagsa ka kabayo, kag pasalahon ang iya manugsakay. Apang muklaton ko ang akon mga mata sa panimalay sang Juda, kon bulagon ang tagsa ka kabayo sang mga katawohan.
Zechariah	12	5	Niyan ang mga pangolo sang Juda magasiling sa ila tagiposoon, ‘Ang mga pumuluyo sang Jerusalem akon kusug sa Ginoo sang mga kasoldadosan, nga ila Dios.’
Zechariah	12	6	“Sa sadtong adlaw himoon ko ang mga pangolo sang Juda kaangay sang kalaha nga kalayo sa tunga sang gatong, kaangay sang sulo nga nagadabadaba sa tunga sang mga linaylay; kag lamonon nila ang tanan nga mga katawohan sa palibut sa too kag sa wala, samtang ang mga sa Jerusalem magapuyo pa liwat sa ila kaugalingon nga duug, sa Jerusalem.
Zechariah	12	7	“Kag ang Ginoo man magaluwas sing una sang mga layanglayang sang Juda, agud nga ang himaya sang panimalay ni David kag ang himaya sang mga pumuluyo sang Jerusalem indi maglabaw sang sa iya sang Juda.
Zechariah	12	8	Sa sadtong adlaw ang Ginoo magaapin sang mga pumuluyo sang Jerusalem agud nga ang maluya sa ila sa sadtong adlaw manginsubong kay David, kag ang panimalay ni David manginsubong sang Dios, subong sang manugtunda sang Ginoo , sa atubangan nila.
Zechariah	12	9	Kag sa sadtong adlaw magatinguha ako sa paglaglag sang tanan nga mga pungsud nga nagasumpung sa Jerusalem.
Zechariah	12	10	“Kag ipasagahay ko sa panimalay ni David kag sa mga pumuluyo sang Jerusalem ang espiritu sang bugay kag sang pag-ampo, kag magatolok sila sa akon nga ila ginbuno, kag magalalaw sila tungud sa iya, subong sang isa nga nagalalaw sa iya bugtong nga anak nga lalaki, kag manginsa kapaitan tungud sa iya, subong sang isa nga yara sa kapaitan tungud sang iya panganay.
Zechariah	12	11	Sa sadtong adlaw may daku nga paglalaw sa Jerusalem subong sang paglalaw sang Adadrimon sa nalupyakan sang Meguido.
Zechariah	12	12	Ang duta magalalaw, ang tagsa ka panimalay sing pahain; ang panimalay sang balay ni David sing pahain, kag ang ila mga asawa sing pahain; ang panimalay sang balay ni Natan sing pahain, kag ang ila mga asawa sing pahain;
Zechariah	12	13	ang panimalay sang balay ni Levi sing pahain, kag ang ila mga asawa sing pahain; ang panimalay sang mga Simeinhon sing pahain, kag ang ila mga asawa sing pahain;
Zechariah	12	14	ang tanan nga mga panimalay nga nabilin, ang tagsa ka panimalay sing pahain, kag ang ila mga asawa sing pahain.
Zechariah	13	1	“Sa sadtong adlaw manginmay tuburan nga nabuksan sa panimalay ni David kag sa mga pumuluyo sang Jerusalem nga sa sala kag sa pagkadimatinlo.
Zechariah	13	2	“Kag sa sadtong adlaw, nagasiling ang Ginoo sang mga kasoldadosan, papason ko sa duta ang mga ngalan sang mga diosdios, kag indi na sila pagdumdumon; kag ang mga manalagna kag ang espiritu nga dimatinlo pataliwanon ko man sa duta.
Zechariah	13	3	Kag kon ang bisan sin-o magpanagna pa, niyan ang iya amay kag ang iya iloy nga nag-anak sa iya magasiling sa iya, ‘Dili ka magkabuhi, kay nagapamolong ka sing kabutigan sa ngalan sang Ginoo ; kag ang iya amay kag ang iya iloy nga nag-anak sa iya magabuno sa iya kon magpanagna sia.
Zechariah	13	4	Sa sadtong adlaw ang mga manalagna magakahuya ang tagsatagsa sang iya palanan-awon kon magpanagna sia; indi sila magsuklub sing kunup nga bulbulon sa paglimbong,
Zechariah	13	5	kondi magasiling sia, ‘Indi ako manalagna, mangunguma ako sang duta; kay gin-ulipon ako kutub sa akon pagkapamatan-on.’
Zechariah	13	6	Kag ang isa magasiling sa iya, ‘Ano bala ining mga pilas sa imo mga kamut?’ Magasabat sia, ‘Ginpilas ina sa akon sa balay sang akon mga abyan.’”
Zechariah	13	7	“Pagmata, O espada, batok sa akon manugpahalab, batok sa tawo nga kaupud nakon,” nagasiling ang Ginoo sang mga kasoldadosan. Samara ang manugpahalab, kag magaaplaag ang mga carnero; lisoon ko ang akon kamut sa mga tinday.
Zechariah	13	8	Sa bug-os nga duta, nagasiling ang Ginoo , ang duha ka bahin niya papason kag mapatay, kag ang ikatlo mabilin sa iya.
Zechariah	13	9	Kag idap-ung ko sa kalayo ang ikatlong bahin, kag ulayon sila subong sang pag-ulay sang pilak, kag sanghiron ko sila subong sang pagsanghid sang bulawan. Sila magatawag sa akon ngalan, kag pamatian ko sila. Magasiling ako, ‘Ini akon katawohan’; kag magasiling sila, ‘Ang Ginoo akon Dios.’”
Zechariah	14	1	Yari karon, ang adlaw sang Ginoo , nagaabut, nga ang imo inagaw bahinbahinon sa tunga nimo.
Zechariah	14	2	Kay tiponon ko ang tanan nga pungsud sa inaway batok sa Jerusalem, kag ang banwa agawon kag ang mga balay atihon kag ang mga babayi luguson; ang katunga sang banwa magakadto sa kabihagan, kag ang salin sang katawohan indi pagpapason sa banwa.
Zechariah	14	3	Niyan magagowa ang Ginoo kag magapakig-away batok sa sadtong mga pungsud subong sang pag-away niya sa adlaw sang inaway.
