Book	Chapter	Verse	TextRomans	8	12	Gani niyan, mga kauturan, mga mangungutang kita, indi sa unud, sa pagkabuhi sono sa unud—
Romans	8	13	kay kon nagakabuhi kamo sono sa unud kamo mapatay, apang kon paagi sa Espiritu ginapakamatay ninyo ang mga buhat sang lawas magakabuhi kamo.
Romans	8	14	Kay ang tanan nga ginatuytuyan sang Espiritu sang Dios mga anak sang Dios.
Romans	8	15	Kay wala kamo makabaton sang espiritu sang kahiolipnan nga sa kahadluk liwat, kondi nakabaton kamo sang espiritu sang pagkaanak. Kon nagatuaw kita, “Abba! Amay!”
Romans	8	16	ang Espiritu gid nagasaksi upud sa aton espiritu nga mga anak kita sang Dios,
Romans	8	17	kag kon mga anak, niyan mga manunubli, mga manunubli sang Dios kag mga masigkamanunubli ni Cristo, kon matuud nga nagaantus kita kaupud niya agud nga paghimayaon man kita kaupud niya.
Romans	8	18	Ginakabig ko nga ang mga pag-antus sa karon nga tion indi takus nga ikapaanggid sa himaya nga ipahayag sa aton.
Romans	8	19	Kay ang hanoot nga pagpaabut sang tinuga nagahulat sang pagpahayag sang mga anak sang Dios;
Romans	8	20	kay ang tinuga nasakup sa kaluyahon, indi sa iya kaugalingon nga kabubut-on kondi sa kabubut-on sadtong nagsakup sa iya sa paglaum;
Romans	8	21	bangud nga ang tinuga gid hilwayon sa kahiolipnan sang pagkamadinulunton kag makaagum sang mahimayaon nga kahilwayan sang mga anak sang Dios.
Romans	8	22	Aton nahibaloan nga ang bug-os nga tinuga nagaugayong sa kasakit sing tingub tubtub karon;
Romans	8	23	kag indi lamang ang tinuga, kondi kita man, nga may nahaunang mga bunga sang Espiritu, nagaugayong sa sulud naton nga nagahulat sang pagkainanak, nga amo ang pagtubus sang aton mga lawas.
Romans	8	24	Kay sa sining paglaum naluwas kita. Karon ang paglaum nga makita indi paglaum. Kay sin-o bala ang nagalaum sang iya makita?
Romans	8	25	Apang kon nagalaum kita sa wala naton makita, ginahulat ta ini nga may pagpailub.
Romans	8	26	Sa amo nga bagay ang Espiritu nagabulig sa aton kaluyahon; kay indi kita makahibalo magpangamuyo sing nagakaigo, apang ang Espiritu gid nagapatunga tungud sa aton nga nagapakilooy nga may mga pag-ugayong nga dimamitlang.
Romans	8	27	Kag ang nagausisa sang mga tagiposoon nakahibalo kon ano ang hunahuna sang Espiritu, bangud nga nagapatunga nga nagapakilooy sia tungud sa mga balaan sono sa kabubut-on sang Dios.
Romans	8	28	Nahibaloan naton nga sa tagsa ka butang ang Dios nagapanghikot nga sa ikaayo upud sa mga nagahigugma sa iya, ang mga ginatawag sono sa iya tinutuyo.
Romans	8	29	Kay ang ginkilala niya nga daan gintangdoan man niya nga daan nga manginsono sa larawan sang iya Anak, agud nga manginpanganay sia sa madamung mga kauturan.
Romans	8	30	Kag ang iya gintangdoan nga daan gintawag man niya; kag ang gintawag niya ginpakamatarung man niya; kag ang ginpakamatarung niya ginhimaya man niya.
Romans	8	31	Niyan ano bala ang aton isiling sa sini? Kon ang Dios apin sa aton, sin-o bala ang batok sa aton?
Romans	8	32	Sia nga wala magpaiway sang iya kaugalingon nga Anak kondi nagtugyan sa iya tungud sa aton tanan, paano bala nga indi sia maghatag sing bunayag sa aton man sang tanan nga butang kaupud niya?
Romans	8	33	Sin-o bala ang makasumbung batok sa mga pinili sang Dios? Ang Dios amo ang nagapakamatarung;
Romans	8	34	sin-o bala ang nagatagudili? Si Cristo Jesus amo ang napatay, hoo, ang ginbanhaw, nga yara sa too sang Dios, nga nagapatunga nga nagapakilooy man tungud sa aton.
Romans	8	35	Sin-o bala ang magapahamulag sa aton sa gugma ni Cristo? Ang kangitngitan bala, ukon kasakit, ukon paghingabut, ukon tiggulutum, ukon kahubo, ukon katalagman, ukon espada?
Romans	8	36	Subong sang nasulat, “Tungud sa imo ginapamatay kami sa bug-os nga adlaw; naisipan kami subong sang mga carnero nga ilihawon.”
Romans	8	37	Wala, sa tanan sining butang labi pa kita sa mga mandadaug paagi sa iya nga naghigugma sa aton.
Romans	8	38	Kay ginatalupangud ko nga bisan ang kamatayon, ukon kabuhi, ukon mga manugtunda, ukon mga punoan, ukon mga butang nga sa karon, ukon mga butang nga palaabuton, ukon mga gahum,
Romans	8	39	ukon kataasan, ukon kadadalman, ukon bisan ano nga iban nga tinuga, indi sarang makapahamulag sa aton sa gugma sang Dios nga yara kay Cristo Jesus nga aton Ginoo.
Romans	9	1	Nagasiling ako sang kamatooran kay Cristo, wala ako nagabutig; ang akon kaisipan nagasaksi sa akon sa Espiritu Santo,
Romans	9	2	nga may daku ako nga kasubu kag kasakit nga walay langan sa akon tagiposoon.
Romans	9	3	Kay makahandum ako nga ako gid manginpinakamalaut kag ginpabulag kay Cristo tungud sa akon mga kauturan, nga akon mga kasimanwa sono sa kaliwat.
Romans	9	4	Sila mga Israelnon, kag ila ang pagkaanak, ang himaya, ang mga katipan, ang paghatag sang kasogoan, ang panimbahon, kag ang mga saad;
Romans	9	5	naigo sa ila ang mga patriarca, kag sa ila kaliwat, sono sa unud, amo ang Cristo. Ang Dios nga labaw sa tanan, dalayawon gihapon. Kabay pa.
Romans	9	6	Apang indi nga ang polong sang Dios daw nanginwalay pulus. Kay indi tanan nga nagikan kay Israel mga taga-Israel,
Romans	9	7	kag indi sila tanan mga anak ni Abraham bangud nga kaliwatan sila niya; apang “Paagi kay Isaac tawgon ang imo mga kaliwatan.”
Romans	9	8	Kon sayoron indi ang mga anak sang unud ang mga anak sang Dios, kondi ang mga anak sang saad ginaisip subong nga mga kaliwatan.
Romans	9	9	Kay amo ini ang polong sang saad, “Sa sining panag-on ako magakari kag si Sara magaanak sing lalaki.”
Romans	9	10	Kag indi lamang ina, kondi si Rebeca man sang nagpanamkon tungud kay Isaac nga aton amay,
Romans	9	11	bisan wala pa sila matawo kag wala nakahimo sing maayo ukon malain, agud nga ang tinutuyo sang Dios sono sa pagpili magpadayon, indi bangud sang mga buhat kondi bangud sang iya pagtawag,
Romans	9	12	ginsiling sa iya, “Ang magulang magaalagad sa manghud.”
Romans	9	13	Subong sang nasulat na, “Ginhigugma ko si Jacob, apang gindumtan ko si Esau.”
Romans	9	14	Niyan ano bala ang isiling ta? May pagkadimatarung bala sa Dios? Malayo ina!
Romans	9	15	Kay nagasiling sia kay Moises, “Magakalooy ako sa kalooyan ko, kag magakaawa ako sa kaawaan ko.”
Romans	9	16	Gani indi sa pagbuut ukon pagpanikasug sang tawo, kondi sa kalooy sang Dios.
Romans	9	17	Kay ang kasulatan nagasiling kay Faraon, “Sa sini gid nga katuyoan ginbangon ko ikaw, agud nga sa imo mapakita ko ang akon gahum kag nga ang akon ngalan mapalapnag sa bug-os nga duta.”
Romans	9	18	Gani nagakalooy ang Dios sa buut niya kalooyan, kag sa buut niya patig-ahon ginapatig-a niya ang tagiposoon.
Romans	9	19	Niyan magasiling ka sa akon, “Ngaa bala nga nagapangita pa sia sing sayup? Kay si sin-o bala ang makasumpung sang iya kabubut-on?”
Romans	9	20	Apang, O tawo, sin-o ka bala nga nagasabat batok sa Dios? Magasiling bala ang gindihon sa nagdihon sa iya, “Ngaa bala nga ginhimo mo ako sing subong?”
Romans	9	21	Wala bala sing gahum sa lunang ang maninihon, sa paghimo gikan sa amo nga linamas sing isa ka suludlan nga sa katahum kag sing isa nga sa manubo nga paggamit?
Romans	9	22	Ano bala kon ang Dios, nga buut magpakita sang iya kasingkal kag magpakilala sang iya gahum, nagbatas sing dakung pagpailub sing mga suludlan sang kasingkal nga takus sa kalaglagan,
Romans	9	23	agud nga mapakilala niya ang kamanggaran sang iya himaya sa mga suludlan sang kalooy, nga gin-aman niya nga daan nga sa himaya,
Romans	9	24	bisan kita nga iya gintawag, indi gikan sa mga Judio lamang kondi sa mga Gentil man?
Romans	9	25	Subong gid sang ginasiling sa Oseas, “Tawgon ko nga ‘akon katawohan’ ang indi ko anay katawohan, kag nga ‘akon hinigugma’ ang indi ko anay hinigugma.”
Romans	9	26	“Kag sa duug diin ginsiling sa ila, ‘Indi kamo akon katawohan,’ didto tawgon sila nga ‘mga anak sang Dios nga buhi.’”
Romans	9	27	Kag si Isaias nagasinggit nahanungud sa Israel: “Bisan ang kadamuon sang mga anak sang Israel subong sang balas sa dagat, ang nabilin sa ila lamang amo ang luwason;
Romans	9	28	kay ang Ginoo magatuman sang iya polong sa duta nga may kaid-id kag pagdali.”
Romans	9	29	Kag subong sang nasiling ni Isaias, “Kon ang Ginoo sang mga kasoldadosan wala makabilin sa aton sing kaliwat, nanginsubong kita kuntani sa Sodoma kag nanginkaangay sa Gomorra.”
Romans	9	30	Niyan ano bala ang isiling ta? Nga ang mga Gentil nga wala magsonod sang pagkamatarung nakadangat sini, nga amo, ang pagkamatarung nga paagi sa pagtoo;
Romans	9	31	apang ang Israel nga nagasonod sang kasogoan sang pagkamatarung wala makadangat sa pagtuman sinang kasogoan.
Romans	9	32	Ngaa bala? Bangud nga wala nila pagpangitaa ini paagi sa pagtoo, kondi nga daw napasad ini sa mga buhat. Nasandad sila sa bato nga kasandaran,
Romans	9	33	subong sang nasulat na, “Yari karon nagabutang ako sa Sion sing bato nga kasandaran sang mga tawo, isa ka igang nga magapukan sa ila; kag ang nagatoo sa iya indi pagpakahuy-an.”
Revelation	1	1	Ang bugna ni Jesu-Cristo, nga ginhatag sang Dios sa iya nga ipakita sa iya mga ulipon ang butang nga dapat mahanabu sing madali; kag ginpadala niya kag ginpakilala ini paagi sa iya manugtunda sa kay Juan nga iya ulipon,
Revelation	1	2	nga nagsaksi sang polong sang Dios kag sang pagpamatuud ni Jesu-Cristo, bisan sang tanan nga iya nakita.
Revelation	1	3	Bulahan ang nagabasa sing mabaskug kag ang mga nagapamati sang mga polong sang tagna, kag nagabantay sang mga butang nga nasulat sa sini; kay malapit na ang tion.
Revelation	1	4	Si Juan sa pito ka iglesia nga yara sa Asia: Ang bugay sa inyo kag paghidait gikan sa iya nga amo karon kag amo anay kag nga magakari, kag gikan sa pito ka espiritu nga yadto sa atubangan sang iya trono,
Revelation	1	5	kag gikan kay Jesu-Cristo nga saksi nga matutum, ang panganay sang mga patay, kag ang manugdumala sang mga hari sa duta. Sa iya nga nagahigugma sa aton kag naghugas sa aton gikan sa aton mga sala bangud sang iya dugo
Revelation	1	6	kag naghimo sa aton nga ginharian, nga mga sacerdote sa iya Dios kag Amay, sa iya ang himaya kag ang kagamhanan sa katuigan kag katuigan. Kabay pa.
Revelation	1	7	Yari karon, nagakari sia kaupud sang mga panganud, kag ang tagsa ka mata makakita sa iya, ang mga naghandus sa iya; kag ang tanan nga kabikahan sang duta magahaya bangud sa iya. Hoo. Kabay pa.
Revelation	1	8	“Ako ang Alpha kag ang Omega,” nagasiling ang Ginoong Dios, nga amo karon kag amo anay kag nga magakari, ang Makaako.
Revelation	1	9	Ako si Juan, inyo utud kag umalambit upud sa inyo sa kapipit-an kag sa ginharian kag sa pagpailub sa kay Jesus, didto anay sa pulo nga ginatawag Patmos tungud sa polong sang Dios kag sa pagpamatuud ni Jesus.
Revelation	1	10	Sa Espiritu ako sa adlaw sang Ginoo, kag nabatian ko sa akon likod ang daku nga tingug nga daw budyong
Revelation	1	11	nga nagasiling, “Ang imo nakita isulat sa isa ka tolon-an kag ipadala sa pito ka iglesia, sa Efeso kag sa Smirna kag sa Pergamo kag sa Tiatira kag sa Sardis kag sa Filadelfia kag sa Laodicea.”
Revelation	1	12	Niyan nagbalikid ako sa pagtan-aw sang tingug nga nagpakighambal sa akon, kag sang nakabalikid nakita ko ang pito ka candelero nga bulawan,
Revelation	1	13	kag sa tunga sang mga candelero ang isa nga kaangay sang anak sang tawo, nga napanaptan sing malaba nga panapton kag nawagkusan sa dughan sing wagkus nga bulawan;
Revelation	1	14	ang iya olo kag ang iya bohok maputi kaangay sang bulbul nga maputi, subong sang nieve; ang iya mga mata subong sang dabdab sang kalayo,
Revelation	1	15	ang iya mga tiil kaangay sang saway nga ginpahining, linubus subong nga sa horno, kag ang iya tingug subong sang daganas sang madamu nga tubig;
Revelation	1	16	sa iya kamut nga too may pito ka bitoon, sa iya baba nagagowa ang isa ka espada nga matalum nga duha sing sulab, kag ang iya nawung subong sang adlaw nga nagasilak sa iya bug-os nga kasanag.
Revelation	1	17	Sang nakita ko sia, napukan ako nga daw patay sa iya tiilan. Apang ginpahamtang niya sa akon ang iya kamut nga too, nga nagasiling, “Dili magkahadluk, ako ang nahauna kag ang katapusan,
Revelation	1	18	kag ang nagakabuhi; napatay ako, kag yari karon nagakabuhi ako sa gihapon, kag yari sa akon ang mga yabi sang Kamatayon kag Hades.
Revelation	1	19	Karon isulat mo ang imo nakita, ang amo karon kag ang mahanabu sa olihi.
Revelation	1	20	Kon nahanungud sa tinago sang pito ka bitoon nga imo nakita sa akon kamut nga too, kag ang pito ka candelero nga bulawan, ang pito ka bitoon amo ang mga manugtunda sang pito ka iglesia kag ang pito ka candelero amo ang pito ka iglesia.
Revelation	10	1	Niyan nakita ko ang isa pa ka makusug nga manugtunda nga nagakunsad gikan sa langit, nga napanaptan sing panganud, nga may balangaw sa iya olo, kag ang iya nawung subong sang adlaw, kag ang iya mga tiil subong sang mga haligi nga kalayo.
Revelation	10	2	Sia may tolon-an nga linokot nga diotay nga nabukad sa iya kamut. Kag gintapak niya ang iya tiil nga too sa dagat, kag ang wala sa duta,
Revelation	10	3	kag nagtawag sa mabaskug nga tingug, subong sang pagngurub sang leon; sang nagtawag sia, ang pito ka daguub nagtonog.
Revelation	10	4	Kag sang nakatonog ang pito ka daguub, buut na ako kuntani magsulat, apang nabatian ko ang tingug gikan sa langit nga nagasiling, “Pat-ini ang ginmitlang sang pito ka daguub, kag dili pag-isulat ini.”
Revelation	10	5	Kag ang manugtunda nga nakita ko nga nagatindug sa dagat kag sa duta nagbayaw sang iya kamut nga too sa langit
Revelation	10	6	kag nagsumpa bangud sa iya nga nagakabuhi sa katuigan kag katuigan, nga nagtuga sang langit kag sang yara sa sini, kag sang duta kag sang mga butang nga yara sa sini, kag sang dagat kag sang mga butang nga yara sa sini, nga wala na sing paglantang pa,
Revelation	10	7	kondi nga sa mga adlaw sang pagtawag sang budyong nga patonggon sang ikapitong manugtunda, ang tinago sang Dios, sono sa ginpahibalo niya sa iya mga ulipon nga mga manalagna, matuman.
Revelation	10	8	Niyan ang tingug nga akon nabatian gikan sa langit nagpakighambal liwat sa akon, nga nagasiling, “Lakat, kuhaa ang tolon-an nga linokot nga nabukad sa kamut sang manugtunda nga nagatindug sa dagat kag sa duta.”
Revelation	10	9	Gani nagkadto ako sa manugtunda kag nagsiling sa iya nga ihatag niya sa akon ang tolon-an nga linokot nga diotay; kag nagsiling sia sa akon, “Kuhaa ini kag kaona; mangin-mapait ini sa imo tiyan, apang sa imo baba matam-is ini subong sang dugus.”
Revelation	10	10	Kag ginkuha ko ang tolon-an nga linokot nga diotay sa kamut sang manugtunda kag ginkaon ini; matam-is ini sa akon baba subong sang dugus, apang sang nakaon ko ini nagpait ang akon tiyan.
Revelation	10	11	Kag ginsilingan ako, “Dapat ka magpanagna liwat nahanungud sa madamung katawohan kag pungsud kag hambal kag hari.”
Revelation	11	1	Niyan ginhatagan ako sing tabun-ak nga kaangay sa sungkud, kag ginsilingan ako: “Tindug kag taksa ang templo sang Dios kag ang halaran kag ang mga nagasimba didto,
Revelation	11	2	apang dili mo pagtakson ang luwang nga sa gowa sang templo; bayaan mo ina, kay ginhatag ini sa mga pungsud, kag tasakon nila ang banwang balaan sing kap-atan kag duha ka bulan.
Revelation	11	3	Kag ihatag ko sa akon duha ka saksi ang gahum sa pagpanagna sing isa ka libo kag duha ka gatus kag kan-uman ka adlaw, nga napanaptan sing panapton nga sako.”
Revelation	11	4	Amo ini sila ang duha ka kahoy nga olivo kag ang duha ka candelero nga nagatindug sa atubangan sang Ginoo sang duta.
Revelation	11	5	Kag kon may tawo nga buut magsamad sa ila, nagagowa ang kalayo sa ila mga baba kag nagalamon sang ila mga kaaway; kon may tawo nga buut magsamad sa ila, dapat sia patyon sa sining bagay.
Revelation	11	6	Ini sila may gahum sa pagtakup sang langit, agud nga indi mag-ulan sa mga adlaw sang ila panagna, kag may gahum sila sa mga tubig sa paghimo nga dugo, kag sa pagsakit sang duta sa tagsa ka kalalat-an, sa masunsun nga buut nila.
Revelation	11	7	Kag sang nakatapus na sila sang ila pagpamatuud, ang sapat nga nagagowa sa kadadalman magapakig-away sa ila kag magadaug kag magapatay sa ila,
Revelation	11	8	kag ang ila mga bangkay magadum-ok sa dalan sang dakung banwa nga sa espirituhanon ginatawag Sodoma kag Egipto, diin ang ila Ginoo ginlansang sa cruz.
Revelation	11	9	Gikan sa mga katawohan kag mga kabikahan kag mga hambal kag mga pungsud ang mga tawo nagatan-aw sa ila mga bangkay sing tatlo ka adlaw kag tunga kag wala magtugut nga ilubung ang ila mga bangkay,
Revelation	11	10	kag ang mga nagapuyo sa duta magakalipay sa ila kag magakasadya kag magadinolotay sila, bangud nga ginsakit sining duha ka manalagna ang mga nagapuyo sa duta.
Revelation	11	11	Apang sa tapus sang tatlo ka adlaw kag tunga ang ginhawa sang kabuhi gikan sa Dios nagsulud sa ila, kag nagtindug sila, kag ginhadlukan sing daku ang mga nakakita sa ila.
Revelation	11	12	Niyan nabatian nila ang mabaskug nga tingug gikan sa langit nga nagasiling sa ila, “Kari kamo diri!” Kag sa itololok sang ila mga kaaway nagkayab sila sa langit sa panganud.
Revelation	11	13	Kag sa sadtong takna may dakung linog, kag napukan ang ikapulo nga bahin sang banwa; ang napatay sa linog pito ka libo ka tawo, kag ang nabilin nalisang kag naghatag sing himaya sa Dios sang langit.
Revelation	11	14	Nagligad ang ikaduhang kailo; yari karon, ang ikatlong kailo magaabut sing madali.
Revelation	11	15	Niyan ang ikapitong manugtunda nagpatonog sang iya budyong, kag may dalagkung mga tingug sa langit, nga nagasiling, “Ang ginharian sang kalibutan nangin-iya sang aton Ginoo kag sang iya Cristo, kag magahari sia sa katuigan kag katuigan.”
Revelation	11	16	Kag ang duha ka pulo kag apat ka tigulang nga nagalingkod sa ila mga trono sa atubangan sang Dios naghapa kag nagsimba sa Dios,
Revelation	11	17	nga nagasiling, “Nagapasalamat kami sa imo, O Ginoong Dios nga makaako, nga amo karon kag amo anay bangud nga ginbaton mo ang imo dakung gahum kag nagsugud sa paghari.
Revelation	11	18	Naakig ang kapungsuran, apang nag-abut ang imo kasingkal, kag ang tion sa paghukom sang mga patay, sa pagbalus sa imo mga ulipon, nga mga manalagna kag mga balaan, kag sa mga nahadluk sa imo ngalan, sa magamay kag sa dalagku, kag sa paglaglag sang mga nagalaglag sang duta.”
Revelation	11	19	Niyan nabuksan ang templo sang Dios sa langit, kag nakita sa iya templo ang kaban sang iya katipan; kag may mga idlab sang kilat, mabaskug nga mga kagahud, mga tonog sang daguub, linog, kag madamul nga ulan sang hielo.
Revelation	12	1	Kag ang dakung tanda nagpahayag sa langit, ang babayi nga napanaptan sing adlaw, nga may bulan sa idalum sang iya mga tiil, kag sa iya olo ang purungpurung nga napulog duha ka bitoon;
Revelation	12	2	nagadala sia kag nagsinggit sa ginasakitan sia, sa kasakit bangud sa pag-anak.
Revelation	12	3	Kag ang isa man ka tanda nagpahayag sa langit; yari karon, ang dakung dragon nga mapula, nga may pito ka olo kag napulo ka sungay, kag sa iya mga olo may pito ka diadema.
Revelation	12	4	Kag naghapay ang iya ikog sang ikatlong bahin sang mga bitoon sa langit, kag gintulak sila sa duta. Kag ang dragon nagtindug sa atubangan sang babayi nga buut na mag-anak, agud nga malamon niya ang bata sa pag-anak sang babayi;
Revelation	12	5	nag-anak sia sing lalaki, ang isa nga magagahum sa tanan nga kapungsuran sa bilogon nga salsalon, apang ginsagmit ang iya bata paibabaw sa Dios kag sa iya trono,
Revelation	12	6	kag ang babayi nagpalagyo pa kamingawan, diin may duug sia nga gin-aman sang Dios, diin masagud sia sing isa ka libo kag duha ka gatus kag kan-uman ka adlaw.
Revelation	12	7	Karon may inaway sa langit, si Miguel kag ang iya mga manugtunda nga nagapakig-away batok sa dragon; kag ang dragon kag ang iya mga manugtunda nagpakig-away,
Revelation	12	8	apang gindaug sila kag wala na sing duug sa ila sa langit.
Revelation	12	9	Kag ginholog ang dakung dragon, yanang dumaan nga man-ug, nga ginatawag nga Yawa kag Satanas, ang manugdaya sang bug-os nga kalibutan—ginholog sia sa duta, kag ang iya mga manugtunda ginholog kaupud niya.
Revelation	12	10	Kag nabatian ko ang mabaskug nga tingug sa langit, nga nagasiling, “Karon nag-abut ang kaluwasan kag ang gahum kag ang ginharian sang aton Dios kag ang pagbulut-an sang iya Cristo, kay ginholog ang manunumbung sang aton mga kauturan, nga nagasumbung sa ila sa atubangan sang aton Dios sa adlaw kag gab-i.
Revelation	12	11	Kag gindaug nila sia bangud sang dugo sang Cordero kag bangud sang polong sang ila pagpamatuud, kay wala nila paghigugmaa ang ila kabuhi bisan tubtub sa kamatayon.
Revelation	12	12	Niyan magkalipay, O langit kag kamo nga nagapuyo sa sini! Apang kailo sa inyo, O duta kag dagat, kay ang yawa nagpanaug sa inyo sa dakung kasingkal, bangud nga nakahibalo sia nga may malip-ot lamang sia nga tion!”
Revelation	12	13	Kag sang pagkakita sang dragon nga ginholog sia sa duta, ginlagas niya ang babayi nga nag-anak sing lalaki.
Revelation	12	14	Apang ginhatag sa babayi ang duha ka pakpak sang dakung aguila agud nga maglupad sia gikan sa atubangan sang man-ug pa kamingawan, sa duug diin batiti-on sia sa isa ka tion, kag mga tion, kag tunga sa tion.
Revelation	12	15	Nagbuga ang man-ug sa olihi sang babayi sing tubig nga subong sang suba, agud nga mapaanud niya sia sa baha.
Revelation	12	16	Apang ang duta nagtabang sa babayi, kag ginbuka sang duta ang iya baba kag gintolon ang suba nga ginbuga sang dragon.
Revelation	12	17	Niyan ang dragon naakig sa babayi, kag nagkadto sa pagpakig-away sa nabilin sang iya kaliwat, nga nagabantay sang mga sogo sang Dios kag nagapamatuud kay Jesus. Kag nagtindug sia sa baybayon sang dagat.
Revelation	13	1	Kag nakita ko ang sapat nga nagatakas gikan sa dagat, nga may napulo ka sungay kag pito ka olo, nga sa iya mga sungay may napulo ka diadema kag sa iya mga olo may ngalan sang pasipala.
Revelation	13	2	Kag ang sapat nga akon nakita kaangay sang leopardo, ang iya mga tiil subong sang iya sang oso, kag ang iya baba subong sang baba sang leon. Kag ginhatag sa iya sang dragon ang iya gahum kag ang iya trono kag dakung pagbulut-an.
Revelation	13	3	Ang isa sang iya mga olo daw napilasan nga ikamatay, apang ang iya pilas nga ikamatay nag-ayo, kag ang bug-os nga duta nagsonod nga may katingala sa sapat.
Revelation	13	4	Nagsimba ang mga katawohan sa dragon, bangud nga ginhatag niya ang iya pagbulut-an sa sapat, kag nagsimba sila sa sapat, nga nagasiling, “Sin-o bala ang kaangay sa sapat, kag sin-o bala ang sarang makapakig-away batok sa iya?”
Revelation	13	5	Kag ginhatagan ang sapat sing baba nga nagahambal sang bugalon kag mapasipalahon nga mga polong, kag gintugutan ini sa paggamit sang pagbulut-an sing kap-atan kag duha ka bulan;
Revelation	13	6	ginbungat niya ang iya baba sa pagpasipala batok sa Dios, nga nagapasipala sang iya ngalan kag iya puluy-an, nga amo, ang mga nagapuyo sa langit.
Revelation	13	7	Subong man gintugutan sia sa pagpakig-away batok sa mga balaan kag sa pagdaug sa ila. Kag ginhatagan sia sing pagbulut-an sa tagsa ka kabikahan kag katawohan kag hambal kag pungsud,
Revelation	13	8	kag magasimba sa iya ang tanan nga nagapuyo sa duta, ang tagsatagsa nga ang iya ngalan wala masulat sa wala pa mapasad ang kalibutan, sa tolon-an sang kabuhi sang Cordero nga gin-ihaw.
Revelation	13	9	Kon ang bisan sin-o may idulungug, magpamati sia:
Revelation	13	10	Kon ang bisan sin-o bilihagon, makadto sia sa kabihagan; kon ang bisan sin-o magpatay sa espada, kinahanglan sa espada sia patyon. Yari ang panawag nga sa pagpailub kag pagtoo sang mga balaan.
Revelation	13	11	Niyan nakita ko ang isa na man ka sapat nga naggowa sa duta; may duha sia ka sungay kaangay sang sa cordero kag naghambal sia subong sang dragon.
Revelation	13	12	Nagahikot sia sang bug-os nga pagbulut-an sang nahaunang sapat sa iya atubangan, kag ginapasimba niya ang duta kag ang mga nagapuyo sa sini sa nahaunang sapat, nga ang iya pilas nga ikamatay nag-ayo.
Revelation	13	13	Nagahimo sia sing dalagkung mga tanda, bisan sa pagpapanaug sang kalayo sa duta gikan sa langit sa itololok sang mga tawo;
Revelation	13	14	kag ginadayaan niya ang mga nagapuyo sa duta paagi sa mga tanda nga gintugut sa iya sa paghimo sa itololok sang sapat, nga nagasiling sa ila sa pagbuhat sing larawan tungud sa sapat nga napilasan sang espada apang nabuhi pa;
Revelation	13	15	kag gintugutan sia sa paghatag sing ginhawa sa larawan sang sapat agud nga ang larawan sang sapat makahambal, kag sa pagpapatay sang indi magsimba sa larawan sang sapat.
Revelation	13	16	Subong man ginapapat-inan niya ang tanan, magamay kag dalagku, manggaranon kag imol, hilway kag ulipon, sa too nga kamut ukon sa agtang,
Revelation	13	17	agud nga wala sing sarang makabakal ukon makabaligya luwas kon sia may pat-in, nga amo, ang ngalan sang sapat ukon ang numero sang ngalan sini.
Revelation	13	18	Ini nagatawag sang kaalam: ang may paghangup mag-isip sia sang numero sang sapat, kay ini numero sang tawo, ang iya numero anum ka gatus kag kan-uman kag anum.
Revelation	14	1	Niyan nagtolok ako, kag yari karon, ang Cordero nagatindug sa Bukid nga Sion, kag kaupud niya ang isa ka gatus kag kap-atan kag apat ka libo nga may ila sang iya ngalan kag sang ngalan sang iya Amay nga nasulat sa ila mga agtang.
Revelation	14	2	Kag nabatian ko ang tingug gikan sa langit subong sang tonog sang madamung tubig kag subong sang tonog sang mabaskug nga daguub; ang tingug nga nabatian ko subong sang tonog sang mga manug-arpa nga nagakutingkuting sang ila mga arpa,
Revelation	14	3	kag nagaamba sila sing bag-ong ambahanon sa atubangan sang trono kag sa atubangan sang apat ka sapat nga buhi kag sang mga tigulang. Walay tawo nga makahibalo sang ambahanon kondi ang isa ka gatus kag kap-atan kag apat ka libo nga tinubus gikan sa duta.
