Book	Chapter	Verse	TextRevelation	10	10	Ginkuha ko an gutiay nga linikid nga basahan dida ha iya kamot ngan ginkaon ko. Matam-is ini sugad hin dugos han dida pa la ha akon baba, kundi han pagtunla ko, nagmaaslom didto ha akon tiyan.
Revelation	10	11	Niyan ginsiring ako, “Kinahanglan igpasangyaw mo na liwat an mensahe han Dyos ngadto han mga katawhan, kanasoran, mga pinulongan, ngan mga kahadian.”
Revelation	11	1	Niyan tinagan ako hin isurukol nga kahoy sugad hin tungkod, ngan ginsiring ako, “Pakadto ngan sukla an templo han Dyos, ngan an altar, ngan ihapa adton naniningba ha templo.
Revelation	11	2	Kundi ayaw pagsukla an bungsaran ha gawas han templo, kay ginhatag na ini hira ha mga Hentil nga magpapasipara han Baraan nga Syudad sulod hini nga kuarenta y dos ka bulan.
Revelation	11	3	Ipadadara ko an akon duha nga mga saksi nga magbabado hin sako; ngan igpapasangyaw nira an mensahe han Dyos sulod hito nga mil dos syintos saysenta ka adlaw.”
Revelation	11	4	Ini nga duha nga mga saksi amo an duha nga mga kahoy nga olibo, ngan an duha nga mga suga nga ibinutang ha atubangan han Ginoo han tuna.
Revelation	11	5	Kon may-ada magpasipara hin paghuka ha ira, maguwa in kalayo tikang ha ira mga baba, ngan pupuohon an ira mga kaaway; ngan dida hini nga paagi papatayon adton magpasipara hin paghuka ha ira.
Revelation	11	6	May-ada nira gahom hin pagsada han langit basi diri makauran ha panahon nga magpapasangyaw hira han mensahe han Dyos. May-ada liwat nira gahom hin paghimo nga dugo han mga burabod han tubig; may-ada liwat nira gahom hin pagdara han bisan ano nga peste nganhi ha tuna, hin sugad ka agsob han ira karuyag.
Revelation	11	7	Kahuman nira pagpasangyaw han ira mensahe, an mananap nga naguwa tikang han kahiladman makikig-away ha ira. Pagdadag-on hira niya ngan pamamatayon hira,
Revelation	11	8	ngan an ira patay nga mga lawas magsasarang dida ha dalan han dako nga syudad diin iginraysang ha kros an ira Ginoo. Sodoma o Ehipto an panigamnan nga ngaran hito nga syudad.
Revelation	11	9	Magtatan-aw han ira mga lawas sulod hin tulo ka adlaw ngan tunga an mga tawo tikang han ngatanan nga mga nasod, mga tribo, mga pinulongan, ngan mga katawhan, ngan diri hira matugot nga iglubong hira.
Revelation	11	10	Malilipay an mga tawo ha tuna tungod han pagkamatay hini nga duha. Magsasaurog hira ngan maggigihataghatag hin mga regalo, kay nagdara adto nga duha nga mga manaragna hin damo nga mga pag-antos ha mga tawo.
Revelation	11	11	Katapos hin tulo ka adlaw ngan tunga, inmabot tikang han Dyos an ginhawa nga nahatag hin kinabuhi, ngan sinmulod ini ha ira, ngan nanindog hira. Duro gud an kahadlok hadton mga nagpakakita ha ira.
Revelation	11	12	Niyan hinbatian han duha nga mga manaragna in dako nga tingog tikang ha langit nga nasiring ha ira, “Saka kamo ngadi!” Samtang nagkikita an ira mga kaaway, kinmayab hira ngadto ha langit ha usa nga dampog.
Revelation	11	13	Dida dayon nagkamay-ada makusog nga linog; naruba an ikanapulo ka bahin han syudad ngan pito ka yukot nga mga tawo in nagkamatay. Nagkahadlok hin duro an nanhibilin nga mga tawo ngan gindayaw nira an pagkagamhanan han Dyos han langit.
Revelation	11	14	Tapos na an ikaduha nga makaharadlok, kundi diri maiha maabot na an ikatulo nga makaharadlok.
Revelation	11	15	Niyan nagpatunog han iya trompeta an ikapito nga anghel, ngan nagka may-ada dagko nga mga tingog ha langit nga nasiring, “An gahom hin paghadi han kalibutan iya na yana han aton Ginoo ngan han iya Cristo, ngan maghahadi hiya ha kadayonan!”
Revelation	11	16	Ngan nanhapa nga nagsingba han Dyos an 24 nga mga katigurangan nga nalingkod dida han ira mga trono ha atubangan han Dyos,
Revelation	11	17	nga nasiring, “Ginoo nga Dyos nga Labi Kamakagarahum han yana ngan han naglabay! Nagpapasalamat kami ha imo nga imo ginamit an imo dako nga gahom, ngan nagtikang ka na hin paghadi!
Revelation	11	18	Nagkasisina an mga Hentil, kay inmabot na an panahon han imo kapungot, an panahon hin paghukom han mga patay. Panahon na hin pagbalos han imo mga surugoon, an mga manaragna, ngan han ngatanan nga imo mga tawo, an ngatanan nga may pagtahod ha imo, an dagko ngan sugad man an gudti. Panahon na hin pagpuo hadton mga nagpupuo han tuna!”
Revelation	11	19	Nabuksan an templo han Dyos didto ha langit, ngan hinkit-an didto an Kahon han Ginsaaran. Ngan nagkamay-ada mga kikidlat, mga dinalugdog, mga lilinti, linog ngan uranos hin mga yelo.
Revelation	12	1	Niyan hinkit-an didto ha langit in dako nga orosahon: may-ada usa nga babaye nga nagbabado han adlaw, ngan natamak han bulan, ngan an iya ulo ginkoronahan hin dose nga mga bitoon.
Revelation	12	2	Tipag-aranak na hiya, ngan iginuliat niya an kaul-ol ngan an kasakit han pag-anak.
Revelation	12	3	May-ada lain nga urosahon nga hinkit-an didto ha langit. May dako nga pula nga dragon, nga pito an iya mga ulo ngan napulo an iya mga sungay, ngan may-ada korona an kada ulo.
Revelation	12	4	Gindanas han iya ikog an ikatulo ka bahin han mga bitoon ha langit ngan pinanlabog niya ha tuna. Tinmukdaw hiya ha atubangan han babaye nga tipag-aranak nga andam hin pagkaon han bata kon matawo na.
Revelation	12	5	Ngan nag-anak an babaye hin lalake nga maghahadi hin mahigpit hin duro han ngatanan nga mga nasod. Kundi gin-agaw an bata ngan gindara ngadto han Dyos ngan han iya trono.
Revelation	12	6	Kinmalagiw an babaye ngadto ha kamingawan, ngadto hin dapit nga gin-andam han Dyos para ha iya, diin pagmamangnoan hiya sulod hin usa ka yukot ug duha ka gatos ug saysenta ka adlaw.
Revelation	12	7	Niyan nahinabo in araway didto ha langit. Hi Miguel ngan an iya mga anghel nakig-away han dragon nga upod liwat han iya sakop nga mga anghel inmato,
Revelation	12	8	kundi nadaog an dragon ngan hiya ngan an iya sakop nga mga anghel waray na tugoti hin pag-ukoy didto ha langit; ginpaiwas hira.
Revelation	12	9	Iginlabog ha gawas an duro kadako nga dragon! Amo hiya adton kadaan nga dako nga halas nga ginngaranan nga Yawa, o Satanas, nga amo an naglimbong han bug-os nga kalibutan. Iginhulog hiya ngadto ha tuna upod an ngatanan nga iya sakop nga mga anghel.
Revelation	12	10	Niyan hinbatian ko in dako nga tingog didto ha langit nga nasiring, “Yana inmabot na an katalwasan tikang han Dyos! Yana iginpakita na han Dyos an iya gahom hin ka Hadi! Yana iginpakita na han iya Mesiyas an iya pagkagamhanan! Kay an natindog ha atubangan han Dyos ngan nagsumbong han aton kabugtoan adlaw gab-i ginpaiwas na ha langit.
Revelation	12	11	Nagdaog ha iya an aton kabugtoan pinaagi han dugo han Kordero, ngan pinaagi han kamatuoran nga iginpasangyaw nira; ngan andam hira hin paghalad han ira kinabuhi, ngan pagpakamatay.
Revelation	12	12	Sanglit, pagkalipay kamo, kalangitan, ngan kamo ngatanan nga nag-uokoy didto! Kundi kamakaharadlok para han tuna ngan han dagat! Kay an Yawa linmusad ngada ha iyo, ngan puno hiya hin pagdumot, kay maaram hiya nga gutiay na la an panahon nga nahibibilin para ha iya.”
Revelation	12	13	Han pakasabot han dragon nga iginlabog hiya ha tuna, ginlanat niya an babaye nga nag-anak han bata nga lalake.
Revelation	12	14	Kundi gintagan an babaye hin duha nga pako hin dako nga agila, basi makalupad hiya ngadto han iya dapit ha kamingawan, diin pagmamangnoan hiya sulod hin tulo ka tuig ngan tunga, ngan mahigagawas hiya han pagsulong han dragon.
Revelation	12	15	Ngan tikang han baba han dragon, ibinugwak niya in tubig nga sugad hin baha, basi mahianod an babaye.
Revelation	12	16	Kundi binuligan han tuna an babaye; ginmutak an tuna ngan ginsuyop an tubig nga ibinugwak han dragon.
Revelation	12	17	Nagdumot gud han babaye an dragon ngan nakig-away hiya han ngatanan nga mga katulinan han babaye, adton ngatanan nga nagtuman han mga sugo han Dyos, ngan mga matinumanon han kamatuoran nga igipahayag ni Jesus.
Revelation	12	18	Ngan an dragon tinmukdaw ha baybayon.
Revelation	13	1	Ngan hinkit-an ko in usa nga mapintas nga mananap nga inmutwal ha dagat. May-ada ini napulo nga mga sungay ngan pito nga mga ulo; ha kada sungay may-ada korona, ngan ha kada ulo hini nahisurat in ngaran nga nagpapakaalo han Dyos.
Revelation	13	2	Pariho hin lyupardo an mapintas nga mananap, may mga tiil nga sugad hin kanan uso, ngan baba nga sugad hin kanan liyon. Gintagan han dragon ini nga mapintas nga mananap han iya kalugaringon nga gahom, han iya trono, ngan han iya dako nga pagburut-an.
Revelation	13	3	Usa han mga ulo han mapintas nga mananap daw sugad hin nasamad hin grabe, kundi nag-upay na ini nga kasamdan. Nahipausa an bug-os nga kalibutan, ngan nagsunod hira han mapintas nga mananap.
Revelation	13	4	Nagsingba han dragon an ngatanan nga mga tawo, kay iginhatag niya an iya pagburut-an ngadto han mapintas nga mananap. Nagsingba liwat hira han mapintas nga mananap nga nasiring, “Hin-o ba in masugad han mapintas nga mananap? Hin-o ba in makakaato hini?”
Revelation	13	5	Gintugotan an mapintas nga mananap hin maparayawon nga pagyakan nga nagtatamsak han ngaran han Dyos, ngan tinugotan liwat ini hin pag-angkon hin pagburut-an sulod hin 42 ka bulan.
Revelation	13	6	Nagtikang ini hin pagpanhimaraot han Dyos, han iya ngaran, han dapit nga inuokyan han Dyos, ngan han ngatanan nga nag-uokoy ha langit.
Revelation	13	7	Gintugotan liwat ini hin pakig-away han mga magtinuohon ngan hin pagpirde ha ira, ngan gintagan ini hin pagburut-an han tagsa nga tribo, nasod, pinulongan ngan mga katawhan.
Revelation	13	8	Magsisingba han mapintas nga mananap an ngatanan nga mga tawo nga nag-uukoy dinhe ha tuna, labot han mga tawo kanay mga ngaran nahisurat na han waray pa hihimoa an kalibutan, dida han basahan han mga buhi nga gintatag-iya han Kordero nga ginpatay.
Revelation	13	9	“Sanglit, pamati, kon may-ada niyo mga durunggan!
Revelation	13	10	Bibihagon manta an birihagon, papatayon manta pinaagi hin espada an paratayon pinaagi hin espada. Nagkikinahanglan ini hin pagpailob ngan pagtoo para han mga magtinuohon.”
Revelation	13	11	Niyan hinkit-an ko liwat in lain nga mapintas nga mananap nga ginmuwa tikang ha tuna. May-ada ini duha nga mga sungay nga sugad hin kanan kordero, ngan an tingog hini sugad hin kanan dragon.
Revelation	13	12	Ginggamit hini an dako nga pagburut-an han syahan nga mapintas nga mananap dida ha iya atubangan, ngan ginpirit hini an tuna ngan adton mga nag-uokoy ha tuna hin pagsingba han syahan nga mapintas nga mananap, kanay grabe nga samad nag-upay na.
Revelation	13	13	An ikaduha nga mapintas nga mananap nagpakita hin dagko nga mga milagro. Nagpalusad ini hin kalayo tikang ha langit, ha atubangan han ngatanan nga mga tawo.
Revelation	13	14	Ngan nalimbongan hini an ngatanan nga mga tawo nga nag-uokoy ha tuna pinaagi han mga milagro nga ginbuhat ha atubangan han syahan nga mapitas nga mananap. Pinapaghimo hira han mapintas nga mananap hin ladawan ha pagpasidungog han mapintas nga mananap nga ginsamad han espada, kundi waray mamatay.
Revelation	13	15	Gintugotan an ikaduha nga mapintas nga mananap hin pagginhawa hin kinabuhi ngadto han ladawan han syahan nga mapintas nga mananap, basi makagyakan an ladawan, ngan makahimo hin pamatay hadton mga diri magsisingba hini.
Revelation	13	16	Ginpirit han mapintas nga mananap an ngatanan nga mga tawo, gudti ug dagko, riko ug kablas, oripon ug talwas, nga mahipatikan an ira tuo nga mga kamot o an ira mga agtang.
Revelation	13	17	Waray makakapalit o makakagbaligya labot kon may-ada niya hini nga nahipatik nga ngaran han mapintas nga mananap o han numero nga natindog hini nga ngaran.
Revelation	13	18	Nagkikinahanglan ini hin kinaadman. An may-ada hibaro makakasabot han kahulogan han numero han mapintas nga mananap, tungod kay ini nga numero natindog para hin ngaran hin usa ka tawo. Sais syintos saysenta y sais ini nga numero.
Revelation	14	1	Niyan sinmiplat ako, ngan nakadto an Kordero natindog ha Bukid han Sion. Kaupod niya in syinto kuarenta y kuatro ka yukot nga mga tawo kanay mga agtang nahisurat an ngaran han Kordero ngan an ngaran han iya Amay.
Revelation	14	2	Hinbatian ko in tingog tikang ha langit nga sugad han haganas hin dako nga busay ngan sugad hin dako nga dinaguhob hin dalugdog. An akon hinbatian nga tingog sugad han tunog hin mga arpa.
Revelation	14	3	Naninindog an syinto kuarenta y kuatro ka yukot nga mga tawo ha atubangan han trono, han upat nga mga buhi nga mga binuhat, ngan han mga katigurangan. Nagkanta hira hin bag-o nga kanta nga hira la an maaram.
Revelation	14	4	Ini hira amo an kalalaken-an nga nagpabilin hin ka put-li, kay waray man hira makighilawas hin kababayen-an; mga uray hira. Nasunod hira han Kordero bisan diin hiya kakadto. Ha ngatanan nga katawhan, hira la an gintubos, ngan amo hira an syahan nga iginhalad ngadto han Dyos nga han Kordero.
Revelation	14	5	Waray gud ha ira buwaon nga waray sadang igsususon ha ira.
Revelation	14	6	Niyan hinkit-an ko in lain nga anghel nga hataas an lupad ha panganuron, dara an waray kataposan nga mensahe han Maupay nga Sumat nga iginpapasaysay ngadto han mga katawhan han tuna, ngadto han tagsa nga tribo, pinulongan, ug nasod.
Revelation	14	7	Nagsiring hiya hin dako nga tingog: “Pasidunggi niyo an Dyos ngan dayawa an iya pagkaharangdon! Kay inmabot na an panahon nga maghuhukom hiya han katawhan. Pagsingba kamo ha iya nga naghimo han langit, tuna, dagat, ngan han mga burabod!”
Revelation	14	8	Sinmunod han syahan in ikaduha nga anghel, nga nasiring: “Napukan na hiya! Napukan na an gamhanan nga Babilonia! Pinainom hini niya han iya bino an ngatanan nga katawhan—an mapintas nga bino han iya maghilas nga kalaw-ayan!”
Revelation	14	9	Sinmunod han duha nga nahiuna in ikatulo nga anghel, nga nasiring hin dako nga tingog, “Adton magsingba han mapintas nga mananap ngan han iya ladawan nga mapatikan ha iya agtang o ha iya kamot,
Revelation	14	10	mainom liwat hiya han bino han Dyos, an bino han iya pagdumot nga iya gin-ipis hin waray sakot ngadto han irimnan han iya kapungot! An ngatanan nga magbuhat hini, pagsasakiton ha kalayo ug asufre, ha atubangan han baraan nga mga anghel ngan han Kordero.
Revelation	14	11	An aso hini nga kalayo nga magpapa-antos ha ira mausbok ngan magtitipaigbaw hin waray kataposan. Waray pagpahuway, adlaw gab-i, adton magsingba han mapintas nga mananap ngan han iya ladawan, ngan hadton napatikan an ngaran han mananap.”
Revelation	14	12	Para hadton magtinuohon han Dyos, hadton nagtuman han mga sugo han Dyos, ngan adton mga magtinuohon kan Jesus, nagkikinahanglan ini hin dako nga pag-ilob.
Revelation	14	13	Niyan hinbatian ko in tingog tikang ha langit nga nasiring, “Igsurat ini: Kapalaran nira nga tikang yana nga mapatay tungod hin pag-alagad han Ginoo!” Nabaton an Espiritu, “Tinuod gud ini. Makakapahuway na hira han ira magbug-at nga pagbudlay, kay maupod ha ira an mga balos han ira pagkabudlay.”
Revelation	14	14	Niyan tinman-aw ako ngan hinkit-an ko in mabusag nga dampog, ngan nalingkod ha bawbaw han dampog in usa nga sugad hin tawo pagkit-on, nga may-ada korona nga bulawan ha iya ulo, ngan nakakakapot hin matarom nga garab.
Revelation	14	15	May-ada liwat usa nga anghel nga ginmawas tikang han templo ngan ginmoliat ngadto han nalingkod ha bawbaw han dampog, “Gamita an imo garab ngan pag-ani na, kay inmabot na an igo nga panahon; hinog na an aranihon ha tuna!”
Revelation	14	16	Ngan ginggarab an aranihon ha tuna hadton nalingkod ha bawbaw han dampog.
Revelation	14	17	Niyan hinkit-an ko in lain nga anghel nga ginmawas han templo didto ha langit, ngan may-ada liwat niya matarom nga garab.
Revelation	14	18	Ngan ginmawas tikang ha altar in lain nga anghel nga amo an tinaporan han kalayo. Ginmoliat hiya ngadto han anghel nga may matarom nga garab, “Gamita an imo garab ngan panguhaa an mga ubas tikang han urubasan ha tuna kay hinog na ang mga ubas!”
Revelation	14	19	Sanglit ginggarab han anghel an mga ubas ha tuna, ngan ikinadto han piriihan han makalilisang nga kapungot han Dyos.
Revelation	14	20	Ginpuga an mga ubas didto han piriihan ha gawas han syudad, ngan inmawas in dugo tikang han piriihan nga may usa ka dupa an kahilarom nga mga upat ka gatos ka kilometro an kahilaba.
Revelation	15	1	Niyan hinkit-an ko didto ha langit in lain nga urusahon ngan maka-aramdok nga taran-awon. Nakita ko in pito nga mga anghel nga dara in pito nga mga peste nga amo na ini an kataposan na mga kasakitan, kay amo ini an kataposan na nga pagpahayag han kapungot han Dyos.
Revelation	15	2	Ngan hinkit-an ko in sugad hin dagat nga salaming, nga sinaktan hin kalayo. Hinkit-an ko adton mga tawo nga nakadaog han mapintas nga mananap ngan han iya ladawan, ngan han usa kanay ngaran tinitindogan hin numero. Naninindog hira ha tabi han dagat nga salaming, nga nakakadara hin mga arpa nga iginhatag ha ira han Dyos.
Revelation	15	3	Nagkakaranta hira han karantahon ni Moises nga surugoon han Dyos, ngan han karantahon han Kordero: “Ginoo nga Dyos nga Labi Kamakagarahum hin pagkadako ngan pagkama-aramdok han imo mga buhat! Hadi han kanasoran, hin pagkamatadong ngan pagka-matuod han imo mga paagi!
Revelation	15	4	Hin-o in diri mahahadlok ha imo, O Ginoo? Hin-o in madiri pagpasangyaw han imo pagkagamhanan? Ikaw gud la an baraan. Makanhi ngan magsisingba ha imo an ngatanan nga kanasoran, kay hinkikit-an han ngatanan an imo magtadong nga mga buhat.”
Revelation	15	5	Katapos hini hinkit-an ko nga naabre an templo ha langit diin nakadto ha sulod hini an Tulda han Ginsaaran.
Revelation	15	6	Ginmuwa han templo an pito nga mga anghel nga may pito nga mga peste; nakakasul-ot hira hin malinis ngan mainggat nga lino nga bado, ngan may-ada nira mga banda nga bulawan nga isinasangbod han ira mga dughan.
Revelation	15	7	Niyan gintagan han usa han upat nga buhi nga mga binuhat an pito nga mga anghel, hin pito nga mga surudlan nga bulawan, nga puno han kapungot han Dyos nga buhi ha kadayonan.
Revelation	15	8	Nalukop an templo hin aso nga tikang han himaya ug gahom han Dyos, ngan waray nakakasulod ngadto han templo tubtob han katapos han pito nga mga peste nga dara han pito nga mga anghel.
Revelation	16	1	Niyan hinbatian ko in dako nga tingog nga tikang han templo nga nagsiring ngadto han pito nga mga anghel, “Pakadto kamo ha tuna ngan ihuwad niyo didto an pito nga mga surudlan han kapungot han Dyos!”
Revelation	16	2	Linmakat an syahan nga anghel ngan iginhuwad ngadto ha tuna an sulod han iya surudlan. Nahiagom hin mag-undag ngan magngutngot nga mga hubag adton mga tawo nga napatikan han tigaman han mapintas nga mananap ngan adton mga nagsingba han iya ladawan.
Revelation	16	3	Niyan ginhuwad han ikaduha nga anghel an sulod han iya surudlan ngadto ha dagat. Nahimo an tubig nga sugad han dugo hin patay nga tawo, ngan nagkamatay an ngatanan nga buhi nga binuhat dida ha dagat.
Revelation	16	4	Niyan ginhuwad han ikatulo nga anghel an sulod han iya surudlan ngadto han mga salog ngan mga burabod hin tubig, ngan nahimo nga dugo ini nga mga tubig.
Revelation	16	5	Hinbatian ko an anghel nga tinaporan han katubigan nga nasiring: “Matadong ka ha imo mga paghukom, O Baraan nga Dyos nga amo yana, ngan amo hadto!
Revelation	16	6	Gin-ula han mga tawo an dugo han mga magtinuohon ngan han mga manaragna, ngan ginpainom mo hira hin dugo. Amo ini an angay ha ira!”
Revelation	16	7	Ngan hinbatian ko in tingog nga tikang han altar nga nasiring, “O Ginoo nga Dyos nga Makagarahum han Ngatanan! Matuod ngan matadong gud an imo mga paghukom!”
Revelation	16	8	Niyan ginhuwad han ikaupat nga anghel an sulod han iya surudlan ngadto han adlaw, basi masunog in damo nga mga tawo tungod han makalilisang nga kamapaso.
Revelation	16	9	Nasunog an mga tawo tungod han makalilisang nga kamapaso, ngan ginpanhimaraot nira an ngaran han Dyos nga may pagburut-an hini nga mga peste. Kundi waray hira bumaya han ira mga sala, ngan waray hira magdayaw han iya pagkaharangdon.
Revelation	16	10	Niyan ginhuwad han ikalima nga anghel an sulod han iya surudlan ngadto han trono han mananap. Nalukop hin kasisidman an ginhadian han mapintas nga mananap, ngan ginkagat han mga tawo an ira dila, tungod han ira mabangis nga gin-aantos,
Revelation	16	11	ngan ginpanhimaraot nira an Dyos han langit tungod hini nga mga mag-ul-ol ngan mga hubag. Kundi waray hira bumaya han ira magraot nga mga binuhatan.
Revelation	16	12	Niyan ginhuwad han ikaunom nga anghel an sulod han iya surudlan ngadto han dako nga Salog Eufrates. Hinmubas ini nga salog, basi kaagian han mga hadi nga tikang han sinirangan.
Revelation	16	13	Ngan hinkit-an ko in tulo nga maghugaw nga mga espiritu nga sugad hin mga pakla, nga naguwa tikang han baba han dragon, han baba han mapintas nga mananap, ngan han baba han diri matuod nga manaragna.
Revelation	16	14	Amo ini an mga espiritu han mga yawa nga nagbubuhat hin mga milagro. Napakadto ini nga tulo nga mga espiritu ha mga kahadian han kalibutan basi pagtirokon hira para han araway dida han dako nga adlaw han Dyos nga Labi Kamakagarahum.
Revelation	16	15	“Pamati kamo! Maabot ako sugad hin kawatan! Palaran adton mag-aagma ngan magbabantay han iya panapton, basi diri hiya maglakat nga lubas ngan maalohan ha atubangan han mga tawo!”
Revelation	16	16	Niyan gindara han mga espiritu an kahadian ngadto hin dapit nga ha Hebreo tinatawag nga “Armagedon.”
Revelation	16	17	Niyan ginhuwad han ikapito nga anghel an sulod han iya surudlan ngadto ha kahanginan. Usa nga dako nga tingog hinbatian tikang ha trono didto han templo, nga nasiring, “Nahuman na!”
Revelation	16	18	Nagkikidlat, nagdalugdog, naglilinti, ngan linminog hin makusog. Waray pa gud sugad hini hin kamakusog nga linog han paghimoa han tawo; amo ini an gikukusogi han ngatanan nga linog!
Revelation	16	19	Nagkatulo ka bahin an kabuka han dako nga syudad nga nagun-ob an ngatanan nga mga syudad han ngatanan nga mga nasod. Nahinumdom an Dyos han dako nga Babilonia, ngan ginlugos niya hin pagpainom han bino tikang han iya irimnan—an bino han iya mabangis nga kapungot.
Revelation	16	20	Naanaw an ngatanan nga mga puro, nawara an ngatanan nga kabukiran.
Revelation	16	21	Nagkahuglog tikang ha langit in dagko nga mga yelo nga natimbang hin mga singkuenta ka kilo an kada usa ngada han mga tawo. Ngan ginpanhimaraot han mga tawo an Dyos tungod han peste han dagko nga mga yelo kay makalilisang gud adto nga peste.
Revelation	17	1	Niyan an usa han pito nga mga anghel nga may-ada pito nga mga surudlan dinmaop ha akon ngan nagsiring: “Pakadi, ngan ipakikita ko ha imo kon uunanhon an pagsirot han babaye nga maraot an bantog, nga amo an dako nga syudad nga gintindog hirani hin damo nga mga salog.
Revelation	17	2	Nakighilawas hini nga maraot nga babaye an kahadian han tuna, ngan nagkahuhubog an mga tawo ha kalibutan tungod han pag-inom han bino han iya maghilas nga kalaw-ayan.”
Revelation	17	3	Sinmakob nganhi ha akon an Espiritu, ngan gindara ako han anghel ngadto hin kamingawan. Didto hinkit-an ko in babaye nga nasakay dida hin pula nga mapintas nga mananap nga luob hin mga ngaran nga nagpapanamastamas han Dyos; an mananap may pito nga mga ulo ngan napulo nga mga sungay.
Revelation	17	4	Granate ngan pula an bado han babaye, ngan luob hiya hin bulawan nga mga sabong, mahal nga mga bato, ngan mga perlas. Nakapot hiya hin kupa nga bulawan nga puno hin maglaw-ay ngan maghugaw nga mga butang ngan mga bunga ini han iya maghilas nga kalaw-ayan.
Revelation	17	5	Nahisurat ha iya agtang in ngaran nga may tinago nga kahulogan: “An Bantogan nga Babilonia, iroy han ngatanan nga magraot an dungog nga kababayen-an, ngan han ngatanan nga magngil-ad dinhe ha kalibutan.”
Revelation	17	6	Ngan hinkit-an ko nga an babaye nahubog han dugo han mga magtinumanon han Dyos, ngan han dugo hadton mga pinanmatay tungod kay inmunong hira kan Jesus. Han pakakita ko ha iya dako gud an akon paghipausa.
Revelation	17	7	Nagpakiana ha akon an anghel, “Kay ano nga nahipapausa ka man? Igsusumat ko ha imo an tinago nga kahulogan han babaye ngan han mapintas nga mananap nga sinasakyan niya nga may-ada pito nga mga ulo ngan napulo nga mga sungay.
Revelation	17	8	Hadto anay, buhi ito nga mapintas nga mananap, kundi yana patay na; ha diri maiha maigarawas ito tikang han kahiladman, ngan papatayon ito nga mananap. An mga tawo dinhe ha tuna, kanay mga ngaran waray mahisurat han waray pa hihimoa an kalibutan didto ha basahan han mga buhi, mapapausa hira kon kumita hira hito nga mananap. Buhi ito hadto anay; yana patay na, kundi mapakita liwat.
Revelation	17	9	“Kinahanglan nga may-ada kinaadman nga hibaro hin pakasabot hini nga mga butang. An pito nga mga ulo amo an pito nga mga pungtod nga linilingkoran han babaye. Mahimo liwat nga pito ini nga mga hadi.
Revelation	17	10	Napukan na an lima ha ira, naghahadi pa in usa, ngan waray pa umabot an usa; kon umabot na hiya, kinahanglan maghadi hiya hin madaliay.
Revelation	17	11	An mananap nga buhi hadto anay, kundi patay na, amo adton ikawalo nga hadi nga kaupod han nahiuna nga pito, ngan papatayon liwat hiya.
Revelation	17	12	“An imo hinkit-an nga napulo nga mga sungay amo adton napulo nga mga hadi nga waray pa makatikang hin paghadi, kundi ihahatag ha ira in gahom hin paghadi upod han mananap, sulod hin usa ka oras.
Revelation	17	13	Uusa la an panuyo hini ngatanan nga napulo nga mga hadi, ngan ihahatag nira an ira gahom ngan pagburut-an ngadto han mananap.
Revelation	17	14	Makikig-away hira han Kordero, kundi pagdadag-on hira han Kordero upod han iya mga tinawag, mga pinili, ngan magtinumanon nga mga sumusunod, kay amo hiya an Ginoo han mga ginoo ngan Hadi han mga hadi.”
Revelation	17	15	Nagsiring liwat ha akon an anghel: “An mga tubig nga linilingkoran han babaye nga maraot an bantog amo an mga nasod, mga katawhan, ngan mga pinulongan.
