Book	Chapter	Verse	Text
Zephaniah	1	1	Amo ini an mensahe nga ginhatag han Ginoo kan Sofonias dida han panahon nga hadi han Juda hi Josias nga anak ni Amon. (Tulin hi Sofonias ni Hadi Ezequias pinaagi kanda Amarias, Gedalias, ug Cusi.)
Zephaniah	1	2	Nagsiring an Ginoo , “Pagbubungkagon ko an ngatanan nga mga butang ha tuna,
Zephaniah	1	3	an ngatanan nga katawhan ug kamanampan, ngan katamsihan ug kaisdaan. Pupukanon ko an mga magraot. Pupuohon ko an ngatanan nga mga tawo, ngan waray gud mahisasalin nga buhi. Ako nga Ginoo an nagyakan.
Zephaniah	1	4	“Kakastigohon ko an mga tawo han Jerusalem ngan han bug-os nga Juda. Paparaon ko an kataposan nga tigaman hin pagsingba kan Baal didto, ngan waray na gud ngani manunumdom han pagano nga kapadian nga nag-aalagad ha iya.
Zephaniah	1	5	Pupuohon ko an bisan hin-o nga nasaka han atop ngan nagsisingba han adlaw, han bulan, ngan han mga bitoon. Pupuohon ko liwat adton mga nagsisingba ha akon ngan nagsusumpa han ira kamaunongon ha akon, kundi nagsusumpa liwat ha ngaran han diyos nga hi Milcom.
Zephaniah	1	6	Pupuohon ko adton mga binmulag nga waray na magsunod ha akon, adton mga diri nadangop ha akon o diri napapagtutdo ha akon.”
Zephaniah	1	7	Hirani na an adlaw nga maghuhukom na an Ginoo ; sanglit paghilom kamo ha iya atubangan. Nag-aandam na an Ginoo hin paghalad han iya mga tawo ngan nagdapit na hin mga kaaway hin panikas han Juda.
Zephaniah	1	8	Nasiring an Ginoo , “Dida hito nga adlaw hin pangihaw, kakastigohon ko an mga opisyal, an mga anak nga kalalaken-an han hadi, ngan an ngatanan nga nanggagawi hin langyaw nga mga pamatasan.
Zephaniah	1	9	Kakastigohon ko an ngatanan nga nagsisingba sugad hin mga pagano ngan nangangawat ngan namamatay basi pagpun-on hin mga kinawat an balay han ira agaron.
Zephaniah	1	10	“Dida hito nga adlaw,” nasiring an Ginoo , “hibabatian niyo in panangis dida han ganghaan han Jerusalem nga ginngaranan nga Ganghaan han Isda. Hibabatian niyo in pagnguyngoy didto han barobag-o pa nga bahin han syudad ngan hin dako nga aringasa hin pagkarumpag didto han kapungtoran.
Zephaniah	1	11	Pagnguyngoy ngan pagtangis kon hibatian niyo ini, kamo nga nag-uokoy didto han uruubos nga bahin han syudad, kay magkakamatay na an ngatanan nga mga magparatigayon!
Zephaniah	1	12	“Dida hito nga panahon makuha ako hin suga ngan uusisahon ko an Jerusalem. Kakastigohon ko an mga tawo nga himyang ngan natapod ha ira kalugaringon, nga nasiring ha ira la ngahaw, ‘Waray an Ginoo magbubuhat hin maupay o maraot.’
Zephaniah	1	13	Paninikason an ira mga manggad ngan panrurub-on an ira mga balay. Diri gud hira mag-uokoy dida han kabablayan nga ira gintitindog o mainom han bino nga abot han mga urubasan.”
Zephaniah	1	14	Hirani na an dako nga adlaw han Ginoo —hiraniay na gud ngan maabot hin madagmit! Magmamapait ito nga adlaw, kay bisan an giiisogi nga mga sondalo magtatangis tungod hin pagturaw!
Zephaniah	1	15	Magigin adlaw ito hin kapungot, adlaw hin kakurian ug kasakitan, adlaw hin pagkaruba ug pagkabungkag, adlaw hin kasisidman ngan kadulom, masirom ngan dampogon nga adlaw,
Zephaniah	1	16	adlaw nga puno han aringasa hin mga trompeta hin away ngan han gogliat han araway hin mga sondalo nga nasulong hin panarig-on nga mga syudad ngan hin higtaas nga mga lantawan.
Zephaniah	1	17	Nasiring an Ginoo , “Padadad-an ko an mga tawo hin sugad nga mga karat-an basi hira ngatanan mangapkap ha ira paglakat sugad hin buta. Nakasala hira ha akon, ngan yana iipison ko an ira dugo sugad hin tubig, ngan madudunot ha tuna an ira patay nga mga lawas.”
Zephaniah	1	18	Dida han adlaw nga ipakita na han Ginoo an iya kapungot, diri makakatalwas ha ira bisan an ngatanan nira nga salapi ug bulawan. Uugtangon an bug-os nga tuna pinaagi han kalayo han iya kasina. Pupuohon niya hin tigda an ngatanan nga nag-uokoy ha tuna.
Zephaniah	2	1	Waray alo nga nasod, panmurubuot daw
Zephaniah	2	2	nga diri ka pa nalalaya ngan nararapdag sugad hin bukad, nga diri pa naabot ha imo an naglalaga nga kasina han Ginoo , nga diri pa naabot an adlaw han iya kapungot.
Zephaniah	2	3	Pangitaa an Ginoo , kamo ngatanan nga mapaubsanon nga mga tawo han tuna, nga nagsusugot han iya mga sugo. Buhata an matadong ngan pagpaubos kamo ha atubangan han Ginoo . Bangin makalikay kamo han kastigo dida han adlaw han kapungot han Ginoo .
Zephaniah	2	4	Waray mahibibilin didto ha syudad han Gaza. Babayaan an Ascalon. Paiiwason an mga tawo han Asdod sulod hin tunga la hin adlaw, ngan paiiwason han ira syudad an mga tawo han Ecron.
Zephaniah	2	5	Maghihikaraot kamo nga mga Filisteohanon, kamo nga mga tawo nga nag-uokoy dida han baybayon. Ginsirotan na kamo han Ginoo . Pupuohon kamo niya, ngan waray usa ha iyo nga mahibibilin.
Zephaniah	2	6	Mahihimo an iyo tuna dida ha ligid han dagat nga kaumhan nga may mga payagpayag hin mga magmarangno hin mga karnero ngan mga tangkal hin mga karnero.
Zephaniah	2	7	Pag-uokyan an iyo tuna han mahisalin nga buhi nga mga tawo han Juda. Papapanabsabon nira didto an ira mga panon ngan mangangaturog hira didto han kabablayan han Ascalon. Maupod ha ira an Ginoo nga ira Dyos ngan pauuswagon na liwat hira.
Zephaniah	2	8	Nasiring an Ginoo nga Labi Kamakagarahum, “Hinbatian ko an mga tawo han Moab ug Amon nga nagtatamay ngan nagpapakaalo han akon mga tawo, ngan naghihinambog nga aagawon nira an tuna.
Zephaniah	2	9	Sugad nga amo gud ako an buhi nga Ginoo nga Dyos han Israel, nagsusumpa ako nga pagbubungkagon ko an Moab ug Amon sugad han Sodoma ug Gomora. Mahihimo hira nga dapit hin mga luong hin asin ngan ruba an ngatanan ngan luob hin kabanwaan. Pagtitikasan hira nga kukuhaon an ira tuna han akon mga tawo nga mahisasalin nga buhi.”
Zephaniah	2	10	Kakastigohon hin sugad an mga tawo han Moab ug Amon tungod han ira kamapahitas-on ug kamaparayawon, ngan tungod han ira pagpakaalo han mga tawo han Ginoo nga Labi Kamakagarahum.
Zephaniah	2	11	Paghahadlokon hira hin duro han Ginoo . Pupukanon niya an kadiyosan han tuna, ngan an ngatanan nga mga tawo magsisingba han Ginoo , an kada usa didto han iya kalugaringon nga tuna.
Zephaniah	2	12	Pamamatayon liwat han Ginoo an mga tawo han Sudan.
Zephaniah	2	13	Gagamiton han Ginoo an iya gahom hin pagpukan han Asiria. Hihimoon niya an syudad han Ninibe nga binayaan nga ruba nga syudad, usa nga mamara nga kamingawan.
Zephaniah	2	14	Magigin usa na la ini nga dapit nga luoban hin mga panon hin kahayopan ngan kamanampan. Mag-uokoy dida han mga buho han rinuba nga mga harigi an mga bukaw ngan dida han mga hagdan an mga uwak, ngan hibabatian an ira mga huni, kay rarangkahon man an sidro nga mga kahoy dida han kabablayan.
Zephaniah	2	15	Amo ini an dadangatan han syudad nga duro hin kamapahitas-on tungod han kalugaringon niya nga gahom, ngan naghuhunahuna nga waray na hiya kataragman. Naghuhunahuna an mga tawo nga an ira syudad amo an gidadakoi dinhe ha kalibutan. Hin kamamingaw nga dapit an dadangatan hini; usa nga dapit nga papahuwayan na la hin ihalas nga kamanampan! Maisol hin duro nga kahadlok an ngatanan nga malabay hini nga mga syudad.
Zephaniah	3	1	Maghihikaraot an Jerusalem, ito nga mahugaw ngan masupilon nga syudad, nga nagraogdaog han kalugaringon niya nga mga tawo.
Zephaniah	3	2	Waray ini mamati han Ginoo o kumarawat han iya mga pagsaway. Waray ini sumarig han Ginoo o makibulig ha iya.
Zephaniah	3	3	An iya mga punoan sugad na la hin mag-isog nga mga liyon; an iya mga maghurukom sugad na la hin gutom nga mga lubo, nga uraura hin kalamot nga kinakaon pati tul-an nga waray salin ha pagkaaga.
Zephaniah	3	4	Diri kasasarigan ngan maglingo an iya mga manaragna; ginhuhugawan han kapadian an butang nga baraan, ngan ginlulubag an balaod han Dyos para la han ira kalugaringon nga kaupayan.
Zephaniah	3	5	Kundi aada la gihapon ha syudad an Ginoo ; ginbubuhat niya an matadong ngan diri gud an sayop. Ha kada aga dayuday gud niya binubuhat an matadong ngada han iya mga tawo. Kundi an diri magtadong nga mga tawo didto nagpapadayon la hin pagbinuhat hin kasaypanan ngan diri hira naaawod.
Zephaniah	3	6	Nasiring an Ginoo , “Ginpuo ko in bug-os nga mga nasod; ginbungkag ko an ira mga syudad, ngan ginbayaan ko ha kabungkagan an ira mga pader nga mga lantawan. Ginbayaan an mga syudad; waray na mga tawo ha kakalsadahan—waray usa nga nahibilin.
Zephaniah	3	7	Naghunahuna ako nga matahod na ha akon an akon mga tawo ngan makarawat na hira han akon mga pagsaway, nga diri na gud nira hingangalimtan an gintutdo ko ha ira nga pagturon-an. Kundi waray la kaiha binmalik na liwat hira han ira maraot nga panggawi.
Zephaniah	3	8	“Hulat la,” nasiring an Ginoo . “Hulata an adlaw kon bumangon na ako hin pagsumbong han mga nasod. Ginlarang ko na hin pagtirok hin mga nasod ngan mga ginhadian basi abaton nira an kusog han akon kasina. Pag-uugtangon ko an bug-os nga tuna pinaagi han kalayo han akon kapungot.
Zephaniah	3	9	“Niyan babalyoan ko an mga tawo han mga nasod ngan mag-aampo hira ngadi ha akon gudla, ngan diri ngadto hin iba nga kadiyosan. Magsusugot ha akon hira ngatanan.
Zephaniah	3	10	Bisan tikang didto han hirayo nga Sudan magdadara ngadi ha akon hin mga halad an akon nagsasarang nga mga tawo.
Zephaniah	3	11	Dida hito nga panahon, mga tawo ko, diri na kamo kinahanglan maawod nga sinmupil kamo ha akon. Kukuhaon ko an ngatanan nga mapahitas-on ngan parayawan, ngan diri na gud kamo masupil ha akon didto han akon baraan nga pungtod.
Zephaniah	3	12	Bibilinan ko didto hin mapinaubsanon ngan makalolooy nga mga tawo nga madangop ha akon hin pakibulig.
Zephaniah	3	13	Diri na magbubuhat hin sayop bisan kan kanay an mga tawo han Israel nga mahibilin nga buhi, diri na magbibinuwa, o maglilimbong. Magmamainuswagon ngan himyang na hira, nga waray na nira sadang kahadlokan.”
Zephaniah	3	14	Pagkanta ngan goliat hin kalipay, mga tawo han Israel! Pagrayhak hin kinasingkasing, Jerusalem!
Zephaniah	3	15	Ginpahunong na han Ginoo an pagkastigo ha iyo; ginkuha na niya an ngatanan niyo nga mga kaaway. Aada ha iyo an Ginoo nga hadi han Israel; waray na kamo sadang kahadlokan.
Zephaniah	3	16	Maabot an panahon nga masiring hira ha Jerusalem, “Ayaw kahadlok, syudad han Sion! Ayaw paluyaha an iyo mga kamot!
Zephaniah	3	17	Aada ha iyo an Ginoo nga iyo Dyos; mahatag hin pagdarag-an an iya gahom. Malilipay ha iyo an Ginoo , ngan ha iya paghigugma tatagan kamo niya hin bag-o nga kinabuhi. Magkakanta ngan magmamalipayon hiya tungod ha iyo,
Zephaniah	3	18	sugad kamalipayon hin mga tawo didto hin pyesta.” Nasiring an Ginoo , “Gintapos ko na an akon pagtarhog hin pagpuo ha iyo ngan ginkuha ko na an iyo kaarawdan.
Zephaniah	3	19	Maabot an panahon! Kakastigohon ko an mga nagtalumpigos ha iyo; tatalwason ko an ngatanan nga piay ngan pauulion ko an mga bihag. Hihimoon ko nga ira kadungganan an ira kaarawdan, ngan pagdadayawon hira han bug-os nga kalibutan.
Zephaniah	3	20	Maabot an panahon! Pauulion ko an iyo nagsasarang nga mga tawo; hihimoon ko kamo nga bantogan ha bug-os nga kalibutan, ngan magmamainuswagon na liwat kamo.” An Ginoo an nagyakan.
Zechariah	1	1	Dida han ikawalo nga bulan han ikaduha ka tuig nga emperador hi Dario han Persia, iginhatag han Ginoo ini nga mensahe kan Zacarias nga manaragna, nga anak ni Berequias ngan apo ni Ido.
Zechariah	1	2	Gintugon hi Zacarias han Ginoo nga Labi Kamakagarahum nga sidngon an mga tawo, “Ako nga Ginoo nasina hin duro han iyo kaapoy-apoyan,
Zechariah	1	3	kundi yana nasiring ako ha iyo, ‘Balik kamo ngadi ha akon ngan mabalik ako ngada ha iyo.
Zechariah	1	4	Ayaw kamo pagsubad han iyo kaapoy-apoyan. Maiha na nga panahon nga iginhatag ha ira han mga manaragna an akon mensahe hin pagsumat ha ira nga diri na hira mag-ukoy hin magraot ngan salaan nga kinabuhi. Kundi waray gud hira mamati o magsugot ha akon.
Zechariah	1	5	Mga patay na an iyo kaapoy-apoyan ngan adto nga mga manaragna.
Zechariah	1	6	Pinaagi han akon mga surugoon nga mga manaragna gintagan ko an iyo kaapoy-apoyan hin mga sugo ngan hin mga pahimatngon, kundi waray la nira ini pagbaliha ngan nag-antos hira han mga nahinabo ha ira. Katapos nagbasol hira ngan kinmilala hira nga ako nga Ginoo nga Labi Kamakagarahum amo an nagkastigo ha ira sugad han angay ha ira ngan sumala han akon pagbuot.’”
Zechariah	1	7	Dida han ika-24 nga adlaw han ika-11 nga bulan (an bulan han Sebat) han ikaduha ka tuig nga emperador hi Dario, iginhatag ha akon han Ginoo in mensahe dida hin usa nga panan-awon ha gab-i.
Zechariah	1	8	Hinkit-an ko in usa nga anghel han Ginoo , nga nasakay hin pula nga kabayo. Hinmunong hiya dida hin kakahoyan nga mirtel didto hin kahamub-an, ngan ha luyo niya may iba nga mga kabayo—pula, kabang, ngan busag.
Zechariah	1	9	Ginpakianhan ko hiya, “Mano, ano an kahulogan hini nga mga kabayo?” Binmaton hiya, “Ipapakita ko ha imo an kahulogan hini.
Zechariah	1	10	Ginpadara ini han Ginoo hin pagsudoy ngan pag-usisa han tuna.”
Zechariah	1	11	Ginsumatan nira an anghel: “Ginsudoy namon an bug-os nga kalibutan, ngan hinkit-an namon nga makalolooy ngan gindaog na an bug-os nga kalibutan.”
Zechariah	1	12	Niyan nagsiring an anghel, “O Ginoo nga Labi Kamakagarahum, nasina ka han Jerusalem ngan han mga syudad han Juda sulod hin 70 na ka tuig. San-o pa nimo ipapakita an imo kalooy ha ira?”
Zechariah	1	13	Ginbaton han Ginoo an anghel hin nakakaliaw nga mga pulong,
Zechariah	1	14	ngan ginsiring ako han anghel nga igsangyaw ko an ginyakan han Ginoo nga Labi Kamakagarahum: “Dako an akon paghigugma ngan pagpaid han Jerusalem nga akon baraan nga syudad,
Zechariah	1	15	ngan nasisina gud ako han mga nasod nga nagpapahimulos hin kalinaw ngan kamurayaw. Kay samtang ginpupugngan ko an akon kasina kontra han akon mga tawo, gindugangan pa gud hini nga mga nasod an mga pag-antos han akon mga tawo.
Zechariah	1	16	Sanglit binmalik ako ngadto ha Jerusalem ha pagpakita han akon kalooy ngadto han syudad. Pagtutukoron ko na liwat an akon Templo ngan pagtitindogon ko na liwat an syudad.”
Zechariah	1	17	Ginsiring liwat ako han anghel hin pagsangyaw: “Nasiring an Ginoo nga Labi Kamakagarahum nga magmamainuswagon na liwat an iya mga syudad ngan pagbubuligan na liwat niya an Jerusalem ngan pag-aangkonon an syudad nga iya kalugaringon.”
Zechariah	1	18	Dida hin lain nga panan-awon hinkit-an ko in upat nga mga sungay hin baka.
Zechariah	1	19	Ginpakianhan ko an anghel nga nakighimangraw ha akon, “Ano an kahulogan hini nga mga sungay?” Binmaton hiya, “Natindog ini para han mga kagamhanan han kalibutan nga nagpasarang han mga tawo han Juda, Israel, ug Jerusalem.”
Zechariah	1	20	Niyan ginpakita ako han Ginoo hin upat nga mga panday nga may mga martilyo.
Zechariah	1	21	Pinmakiana ako, “Ano an ginkanhi hini nga mga tawo?” Binmaton hiya, “Kinmanhi hira hin paghadlok ngan pagpukan han mga nasod nga nagpukan han tuna han Juda ngan nagpasarang han iya mga tawo.”
Zechariah	10	1	Pangaro han Ginoo hin uran ha panahon han pamugas ug pananom. An Ginoo amo an nagpapadara hin ig-uuran nga mga dampog ngan mga tarahiti nga nagpapalangbo han mga tanom ha kaumhan.
Zechariah	10	2	An mga tawo napakadto hin mga diyosdiyos ngan mga paratigo hin pangaro hin bulig, kundi mga buwa ngan kalurongan la nga mga baton an ira nakukuha. Naghuhubad hin mga inop an iba, kundi ginlilipatlipat la kamo; waray la kapulsanan an pagliaw nga ira ihinahatag. Sanglit nagsasarang an mga tawo sugad hin mga karnero nga nawawara. Naghihimakuri hira kay waray nira pangulo.
Zechariah	10	3	Nasiring an Ginoo , “Nasisina ako hito nga mga lumalangyaw nga nagpapangulo han akon mga tawo, ngan pagkakastigohon ko hira. Akon an mga tawo han Juda, ngan ako nga Ginoo nga Labi Kamakagarahum an magmamangno ha ira. Hihimoon ko hira nga gamhanan nga mga kabayo hin pakig-away.
Zechariah	10	4	Tikang ha ira maabot in mga punoan, mga pangulo, ngan mga kapitan nga magdudumara han akon mga tawo.
Zechariah	10	5	Magmamadaogon an mga tawo han Juda sugad hin mga sondalo nga nagtatamaktamak han ira mga kaaway dida han lapok han kakalsadahan. Makikig-away hira kay kaupod nira an Ginoo , ngan ira pipirdehon bisan an mga kaaway nga dikabayo.
Zechariah	10	6	“Pakukusgon ko an mga tawo han Juda; tatalwason ko an mga tawo han Israel. Kalolooyan ko hira, ngan dadad-on ko hira hin pag-uli ha ira nasod. Masusugad hira hin waray ko igsalikway. Amo ako an Ginoo nga ira Dyos; babatonon ko an ira mga pag-ampo.
Zechariah	10	7	Magmamakusog an mga tawo han Israel sugad hin mga sondalo, magmamalipayon hira sugad hin mga tawo nga nag-ininom hin bino. Hinunumdoman han ira mga tulin ini nga pagdarag-an, ngan magmamalipayon hira tungod han ginbuhat han Ginoo .
Zechariah	10	8	“Tatawgon ko an akon mga tawo ngan pagtitirokon ko hira. Tutubson ko hira ngan padadamoon ko hira sugad hadto anay.
Zechariah	10	9	Bisan kon ginpasarang ko hira dida han mga nasod, kundi manunumdom hira ha akon didto ha kahigrayoan. Hira ngan an ira mga anak mahisasalin nga buhi, ngan magbuburunyog hira hin pag-uli.
Zechariah	10	10	Dadad-on ko hira hin pag-uli tikang ha Ehipto ug Asiria, ngan igpapahimutang ko hira didto han ira kalugaringon nga nasod. Igpapahimutang ko liwat hira didto ha Galaad ug Libano; mapupuno hin mga tawo an bug-os nga tuna.
Zechariah	10	11	Kon magkuri hira hin pagtalabok han ira dagat, ako nga Ginoo an maghahampak han mga balod, ngan magmamara an mga salad han Nilo. Ipapaubos ko an mapahitas-on nga Asiria, ngan mawawad-an han iya gahom an gamhanan nga Ehipto.
Zechariah	10	12	Pakukusgon ko an akon mga tawo; pagsisingbahon ngan pagsusugton ako nira.” An Ginoo an nagyakan.
Zechariah	11	1	Buksi an imo mga porta, Libano, basi maugtang hin kalayo an imo kakahoyan nga sidro!
Zechariah	11	2	Pagtangis ngan pagnguyngoy, kakahoyan nga sipres— napukan na an mga sidro; nagkatutumba na adton mag-anyag nga kakahoyan! Pagtangis ngan pagnguyngoy, mga tuog han Basan— pinanmulod na an kakahoyan ha kagurangan!
Zechariah	11	3	Nagoliat tungod hin kabido an mga punoan; waray na an ira pagkaharangdon! Pamatii an pagngurob han mga liyon; nabungkag an ira urokyan nga kagurangan didto ha ligid han Jordan!
Zechariah	11	4	Nagsiring ha akon an Ginoo nga akon Dyos, “Tumana an imo ka magmarangno hin panon hin mga karnero nga irihawon.
Zechariah	11	5	Naihaw an mga tag-iya han ira karnero ngan diri la ini hira ginsisirotan. Iginbabaligya nira an karne hini ngan nasiring, ‘Pagdayawon an Ginoo ! Mga riko na kami!’ Waray pagkalooy han mga karnero bisan an ira kalugaringon nga mga magmarangno.” (
Zechariah	11	6	Nasiring an Ginoo , “Diri na gud ako malolooy han bisan hin-o dinhe ha tuna. Ako ngahaw an magbubutang hini nga mga tawo ha gahom han ira mga punoan. Pagwawakayon hini nga mga punoan an tuna ngan waray usa ha ira nga akon tatalwason tikang han ira gahom.”)
Zechariah	11	7	Ginsuholan ako hadton mga nagpalit ngan nagbaligya han mga karnero, ngan nahimo ako nga magmarangno han mga karnero nga irihawon. Kinmuha ako hin duha nga tabog: ginngaranan ko nga “Pagkalooy” an usa ngan “Pagkausa” an ikaduha. Ngan ginmangnoan ko an panon.
Zechariah	11	8	Waray ako makailob han tulo nga magmarangno nga nagdumot ha akon, ngan ginpatay ko hira ngatanan sulod hin usa ka bulan.
Zechariah	11	9	Niyan ginsiring ko an panon, “Diri na ako an iyo magmarangno. Mamatay na la adton tikamaratay. Mapuo na la adton tikapuruo. Magpapaunay-unay adton mga nahibibilin.”
Zechariah	11	10	Niyan kinuha ko an tabog nga ginngaranan, “Pagkalooy” ngan ginbari ko ini, pagpara han ginsaaran nga ginhimo han Ginoo ngan han ngatanan nga mga nasod.
Zechariah	11	11	Sanglit dida hito nga mga adlaw ginpara an ginsaaran. Nag-ininaw ha akon adton mga nagpalit ngan nagbaligya han mga karnero, ngan nakasabot hira nga naghimangraw an Ginoo pinaagi han akon ginbuhat.
Zechariah	11	12	Ginsiring ko hira, “Kon karuyag niyo, ihatag ha akon an akon suhol. Kon diri, ayaw na la.” Sanglit ginbaydan ako nira hin 30 ka bug-os nga salapi nga akon suhol.
Zechariah	11	13	Nagsiring ha akon an Ginoo , “Huloga ini didto han hirimosan hin kwarta han Templo.” Sanglit kinuha ko an 30 ka bug-os nga salapi—an dako nga kantidad nga ira ginhunahuna nga angay ha akon—ngan ginhulog ko ini didto han hirimosan hin kwarta han Templo.
Zechariah	11	14	Niyan ginbari ko an ikaduha nga tabog, nga ginngaranan, “Pagkausa” ngan nabungkag an pagkausa han Juda ug Israel.
Zechariah	11	15	Niyan nagsiring ha akon an Ginoo , “Tumana na liwat an imo ka magmarangno, kundi yana waray ka na pulos nga magmarangno.
Zechariah	11	16	Iginbutang ko in magmarangno nga tinaporan han akon panon, kundi diri hiya nabulig han mga karnero nga tikamaratay; o nagbibiling han mga nawara, o nagtatambal hadton mga nasamad, o nagtutubong han mga nanhisalin nga buhi. Kinakaon lugod niya an karne han gitatamboki nga mga karnero ngan kinukuha niya an mga kulo hini.
Zechariah	11	17	Maghihingaraot ito nga waray pulos nga magmarangno! Ginbayaan niya an iya panon. Mawawaray hiya gahom tungod hin araway. Maluya na an iya butkon ngan mabubuta an iya tuo nga mata.”
Zechariah	12	1	Mensahe ini tikang han Ginoo hiunong han Israel, an Ginoo nga nagbitad han kalangitan, nagtuha han tuna, ngan naghatag hin kinabuhi han tawo. Nasiring hiya,
Zechariah	12	2	“Hihimoon ko an Jerusalem nga sugad hin kopa hin bino; mainom an mga nasod nga hirani ha iya ngan magruruogduog sugad hin mga hubog. Ngan kon sumulong an mga nasod han Jerusalem, susulongon man liwat an iba nga mga syudad han Juda.
Zechariah	12	3	Kundi kon umabot na ito nga panahon, hihimoon ko an Jerusalem nga sugad hin mabug-at nga bato—masasamad an bisan ano nga nasod nga magpasipara hin pag-alsa hini. Mag-uurosa han ira mga kusog an ngatanan nga kanasoran han kalibutan hin pagsulong han Jerusalem.
Zechariah	12	4	Dida hito nga panahon hihimoon ko nga magkalilisang an mga kabayo ngan hihimoon ko nga mga tuyaw an ngatanan nira nga mga nasakay han kabayo. Babantayan ko an mga tawo han Juda, kundi bubutahon an mga kabayo han ira mga kaaway.
Zechariah	12	5	Niyan masiring ha ira la ngahaw an mga banay han Juda, ‘An Ginoo nga Dyos nga Labi Kamakagarahum nahatag hin kusog ngadto han iya mga tawo nga nag-uokoy didto ha Jerusalem.’
Zechariah	12	6	“Dida hito nga panahon hihimoon ko an mga banay han Juda nga sugad hin kalayo didto hin kagurangan o didto hin uma nga hinog para hin pag-ani—pagbubungkagon nira an ngatanan nga higrani nga mga nasod. Magpapabilin an mga tawo han Jerusalem nga waray kataragman didto ha sakob han syudad.
Zechariah	12	7	“Ako nga Ginoo an mahatag hin pagdarag-an syahan ngadto han mga kasondalohan han Juda, basi an kadungganan nga kakarawaton han mga tulin ni David ngan han mga tawo han Jerusalem diri lumabaw han iba didto ha Juda.
Zechariah	12	8	Dida hito nga panahon pananalipdan han Ginoo adton mga nag-uokoy didto ha Jerusalem, ngan masusugad kan David ka makusog bisan an labi hin kamaluya dida ha ira. An mga tulin ni David magmamando ha ira sugad han anghel han Ginoo , sugad han Dyos ngahaw.
Zechariah	12	9	Dida hito nga panahon bubungkagon ko an tagsa nga nasod nga magtalinguha hin pagsulong han Jerusalem.
Zechariah	12	10	“Pupun-on ko an mga tulin ni David ngan an iba nga mga tawo han Jerusalem han espiritu han pagkalooy ngan han espiritu han pag-ampo. Tatan-awon nira adton ira ginbuno ngan magmamabidoon hira tungod ha iya sugad hadton mga nagmamasulob-on tungod hin uusa la nga anak. Magmamasulob-on gud hira sugad hadton mga nawad-an han ira suhag nga lalake.
Zechariah	12	11	Dida hito nga panahon masusugad ka dako an kasubo didto ha Jerusalem han kasubo para kan Hadadrimon didto ha kapatagan han Meguido.
Zechariah	12	12-14	Maglulugaring la hin pagkamasulob-on an kada panimalay didto han tuna: an panimalay nga tinmikang kan David, an panimalay nga tinmikang kan Natan, an panimalay nga tinmikang kan Levi, an panimalay nga tinmikang kan Simei, ngan an ngatanan nga iba nga mga panimalay. Maglulugaring la hin kamasulob-on an kada panimalay, ngan an kalalaken-an han kada panimalay malain han kababayen-an hin pagkamasulob-on.
Zechariah	13	1	“Kon umabot na ito nga panahon,” nasiring an Ginoo nga Labi Kamakagarahum, “matubod in burabod nga maglilinis han mga tulin ni David ngan han mga tawo han Jerusalem han ira sala ngan pagsingba hin mga diyosdiyos.
Zechariah	13	2	Dida hito nga panahon kukuhaon ko an mga ngaran han mga diyosdiyos tikang han tuna, ngan waray na gud mahinunumdom ha ira. Paiiwason ko an bisan hin-o nga nasiring nga manaragna hiya, ngan kukuhaon ko an ungara hin pagsingba hin mga diyosdiyos.
Zechariah	13	3	Niyan kon may-ada pa magpapadayon hin pagpanagna, susumatan hiya han iya kalugaringon nga amay ug iroy nga kinahanglan patayon hiya, kay nagsiring hiya nga nagyayakan hiya han pulong han Ginoo , kundi naghimangraw lugod hiya hin mga buwa. Kon managna hiya, bubun-on hiya han iya kalugaringon nga amay ug iroy.
Zechariah	13	4	Kon umabot na ito nga panahon, waray manaragna nga naparayaw han iya mga panan-awon, o magbubuhat sugad hin manaragna, o magbabado hin barahiboon nga bado hin manaragna, basi makaglimbong hin mga tawo.
Zechariah	13	5	Lugod masiring hiya, ‘Diri ako manaragna. Parauma ako—nag-uma ako han tuna ha bug-os ko nga kinabuhi.’
Zechariah	13	6	Niyan kon may magpakiana ha iya, ‘Ano man ito nga mga samad dida han imo dughan?’ mabaton hiya, ‘Naangkon ko ini didto han balay hin usa nga sangkay.’”
Zechariah	13	7	Nasiring an Ginoo nga Labi Kamakagarahum, “Pagmata, espada, ngan sulonga an magmarangno nga nagbabantay ha akon ngaran! Pataya hiya ngan magsasarang an mga karnero. Susulongon ko an akon mga tawo,
Zechariah	13	8	ngan magkakamatay in duha han tulo ka bahin han mga tawo ha bug-os nga tuna.
